Source,Domain,Heading,Category,URL,Text
Medium.com,Innovation & Tech,Master UX with React in 2020: Four Ways to Upgrade Your React App User Experience,UX,https://medium.com/javascript-in-plain-english/master-ux-with-react-in-2020-four-ways-to-upgrade-your-react-app-user-experience-349b5790877f?source=topic_page---------9------------------1," If your application gives the user a good feeling, they are more likely to continue using it. 2020
is right around the corner, which means more React apps are coming to the market. It is prime time to learn new UX tactics to stay ahead of the curve, and keep your app competing with the best!
Today we will be looking at some of the tactics that the top players of the industry are using. Placeholder content, micro-interactions, loading screen strategies, smooth fades & transitions, there is much room for improvement in each of our applications. Let’s see how we can implement these tactics in React and keep our users engaged. Loading screens are a good place to start our journey of improving the feel of our applications. In the example above we are fetching data from three separate API’s before displaying the welcome screen. In the “before” loading screen, we are leaving the user in the dark. Whatever processes are running in the background are completely hidden from the user. In the “after” loading screen, we show the user what’s going on behind the scenes, then give a positive confirmation when each process finishes. The user feels they are part of the process, and it feels good. Instead of using the classic react-loading or react-spinners libraries, try spicing up your loading animations with the powerful react-lottie package. You can head over to lottiefiles.com and pick from a selection of thousands of user-submitted animations to use in place of the boring spinner icon. Once you find an animation you like, you can open it in lottiefiles’ full blown editor, where you can edit every layer, playback-speed, dimensions, background-color, and more, all inside of the browser! For a step by step guide of how to implement these loading tactics with code examples, you can refer to this in-depth article. Let’s take a look at the before and after in the example above. In the before example, we have a simple loader animation having us wait for some mysterious content, then unexpectedly throws us some cards when it is done loading. In the after example, notice the smooth gradient moving across the placeholder cards, indicating to the user that we are loading some content for them here, and then gracefully fading the results into their designated slots. The page should always look and feel structurally sound. An important takeaway from this strategy is the structure of the page before and after loading. The placeholder content ensures the page is always holding consistent dimensions, both before and after loading the content in. If we opt to use a simple loader, the page will potentially have to resize itself to fit the content after it loads in. Luckily Danilo Woznica has built two tremendously useful tools to design and implement these placeholders in React:
React-Content-Loader and Create-Content-Loader Create-Content-Loader is a tool to help us generate a placeholder component, and it comes with some useful presets such as the Instagram layout, Facebook layout, code placeholder, etc. Almost every platform you come across nowadays has implemented this tactic, you should too! For a step by step guide on how to implement this in your app with code examples, check out this article. Our applications are always moving from screen to screen, constantly throwing data at the user. How we can handle these transitions in the most elegant and beautiful manor? Let’s take a look at the before and after example above. In the before example, the welcome screen immediately pops up, no animation, no transition, just sitting there. Ugly. Then we click on our inbox and get a rigid transition straight to some messages. I don’t really enjoy using this person’s application, it just feels basic.
On the other hand, when looking at the after example, try to pay attention to this first milliseconds of the GIF. The present pops open with an exciting short animation, then the welcome text and button fade in from the bottom of the screen. Smooth. Once I click the inbox, the messages elegantly fade in to view, sliding into their places one by one. Nice. Thanks to a useful library, react-fade-in, you don’t have to deal with any CSS. You simply wrap ANY component with a <FadeIn> tag, and it will automatically animate each child, one by one. You can also just wrap the parent with <FadeIn> and it will animate everything as one block. The <FadeIn> component can take two props: delay: Default: 50. Delay between each child's animation in milliseconds. transitionDuration: Default: 400. Duration of each child's animation in milliseconds. This small, simple addition will help upgrade your application’s user experience. This tactic can be used to fade in text, images, lists, and any other React component you can think of. You can even wrap your entire app in a <FadeIn>! For a step by step guide on how to implement this tactic in your app with code examples, please refer to this article. Medium holds the perfect example of an improved user experience. Pressing it is an instant dopamine release. Confetti, bright glowing animations, a sharp vibrate when pressed on mobile, this clap button is fun to interact with. These micro-interactions are an instant way to get users to fall in love with your application. Let’s take a look at the before and after example above. The before example simply indicates that it was pressed with a color change. Bland, but gets the job done. The after example immediately gives you an attractive green outer-glow when you hover over the button, teasing you into pressing it. Once pressed, you get a blast of confetti and a bright green indicator that fades up smoothly, an ultimately seducing interaction that forces you to give it a couple more clicks. The before example isn’t necessarily bad… and it gets the job done… but I had fun clicking the other clap button. So ask yourself, is your app fun to use? If you would like to implement this component in React, you can use the react-clap-button library by KikoBeats. This library is customizable, meaning you can switch out the icon, change the color scheme, and manipulate the counting mechanism. The quickest way to get up and running with micro-interactions is by using this small but incredible library, react-rewards. Whether you need a burst of confetti, a parade of emojis, or a groovy shape animation, implementation of this highly customizable library is as easy as wrapping any component with the <Reward> tag. A step by step guide on how to implement micro-interactions in your React app with code examples can be found here. There are certain apps you come across that give you a good feeling, you have fun interacting with them and will therefore come back for more action. Look for ways to do this in your app, it is both fun and holds more utility than it may seem. It can be as simple as an interactive clap button, it can be as subtle as perfect fades and transitions, or it can be as explosive as confetti and emojis. Find what works for your context. Thanks for reading and have a great new year!"
Medium.com,Innovation & Tech,The True Beauty of Material-UI,UX,https://medium.com/better-programming/the-true-beauty-of-material-ui-d76fa3dc0dd4?source=topic_page---------10------------------1, Functionality is not everything. Even the most brilliantly coded apps can fall short of their potential without intuitive aesthetic design.
Medium.com,Innovation & Tech,How to Break into User Research,UX,https://uxdesign.cc/how-to-break-into-user-research-932ce8ef47a0?source=topic_page---------11------------------1," One of the number one questions I get every week are people asking me how to break into the field of user research from another role or right after graduating. I speak with people from all different disciplines, some closer to user research, such as marketing, psychology or design, and others further away, such as accountants or writers. One thing I love about user research is that the skills you need to break into a field are about relating to and empathizing with humans. For me, it has been one of the most rewarding jobs I could ever have imagined. Through user research, I can have a positive impact on both users and team members. Another great thing? I genuinely believe most people can become great user researchers, without paying loads of money for a degree or certificate. To prove this, here is my story of how I broke into this field and some tips to go with it. Getting into user research was one of the least straight-forward paths I have taken, and that is often the case for most people breaking into this field. There is no one magic course to take or one perfect path that will guarantee you an entry into any user research job. It is one of the more difficult specialties to get into because of the indirect pathway, especially when even the entry-level jobs seem to have a mountain of requirements. A lot of my students ask if they should go back to school to get a Masters. With this degree, there will be a higher chance of them getting noticed. Most of the time, I would, quite honestly, say no. The only exception is if the degree encompasses other interests and potential career paths. For example, one of my students is potentially interested in becoming a user researcher, but also might end up in policy research. In this case, it might make sense for him to pursue this degree. Aside from that case, I would argue that it is not necessary to go back to school to get into user research. I was able to get into user research through an internship in New York City. I had just finished my MA degree in psychology (yes, I know I said you don’t need a higher degree to get a job, but wait for it), and decided I didn’t want to continue with pursuing my Ph.D. Instead, I wanted to join the world of user research. My MA degree was in clinical psychology and came with some knowledge of statistics. The role I finally received was as a user research intern, with a qualitative focus, at a tech company. I had never worked at a tech company before, and let me tell you, my Master’s degree could never have prepared me for the experience. I took a few different steps when I started looking at and applying to different UX research positions. Below is (what I remember) of my crazy process of diving into this unknown world: Practicing user research is an essential part of creating a portfolio and getting “experience.” Yes, I honestly look back on those pieces now and laugh, BUT, I got an internship, and a few other interviews because of those small projects. I put in a lot of amount of effort into three case studies, and it helped me when I went to apply and interview. They weren’t perfect, not even close, but they showed initiative and my passion for learning and being a part of this field. What else do you want for an intern or junior role? I have some final thoughts on why a degree won’t help you as a user researcher. The most critical and best way to learn user research is to be in an environment with user research. It is absorbed by practice, not by theory. Unfortunately, at this moment, user research is not being taught this way anywhere. There may be aspects of this in an MA program, but I believe the best thing you can do for yourself is to get into an environment in which you are learning user research through doing and observing. MA programs will give you a theory to work off of, but the practical experience isn’t there. I prefer aspiring researchers to spend two years trying to get into an apprenticeship or internship than spend two years learning, and then try to get into an entry-level research position. Check out my website for some resources to get you started on user research (such as templates and guides): www.userresearchacademy.com. As always, feel free to leave any questions or comments."
Medium.com,Innovation & Tech,Strategies for quantitative UX: From concepts to implementation,UX,https://uxdesign.cc/strategies-for-quantitative-ux-from-concepts-to-implementation-f774944930c?source=topic_page---------12------------------1,
Medium.com,Innovation & Tech,"Cars as friends — an emotional, anthropomorphic UX case study",UX,https://uxdesign.cc/cars-as-friends-2c17ef357293?source=topic_page---------13------------------1,
Medium.com,Innovation & Tech,Why you should stop designing multiple proposals,UX,https://uxdesign.cc/why-you-should-stop-designing-multiple-proposals-ad7b08bfa7c7?source=topic_page---------14------------------1,
Medium.com,Innovation & Tech,UX Inspiration #6: Grammarly’s demo onboarding,UX,https://uxdesign.cc/ux-inspiration-6-grammarlys-demo-onboarding-caf7b14498c7?source=topic_page---------15------------------1,
Medium.com,Innovation & Tech,10 rules of thumb in UI design,UX,https://uxdesign.cc/10-rules-of-thumb-in-ui-design-aa5f91885444?source=topic_page---------16------------------1,
Medium.com,Innovation & Tech,First-Time Facilitator,UX,https://uxdesign.cc/first-time-facilitator-435b3220a5da?source=topic_page---------17------------------1," Back in September, I had the opportunity to plan and facilitate my very first design sprint at Passport Inc. Like any growing product team, Passport had never conducted a process like this before. So after much campaigning and convincing everyone from product directors to product managers; I was able to gain enough buy-in to get one scheduled for our Enforcement product. For those that might not know, a design sprint is a structured, decision-making process typically consisting of a team of 8 people. The team spends about a week working through activities of understanding the problem, sketching, prototyping, and ultimately user-testing a final solution. Design sprints allow teams to quickly validate their assumptions while avoiding wasted time building the wrong solution. If you’d like to know more about design sprint there are plenty of great resources out there including this and that. I was originally exposed to design sprints at a previous company where I quickly realized the value in this process and became eager to bring this style of design thinking to Passport. So when the opportunity arose, I began researching everything there is to know about facilitating design sprints. As many do, I started with Jake Knapp’s Sprint book, I studied AJ&Smarts revised sprint process (Design Sprint 2.0); I read every design sprint article and watched every how-to video I could find on the subject. With the support of my team, I partnered up with the Enforcement product manager and we started planning. We decided on a slightly abbreviated timeline as this pilot design sprint didn’t require a full week’s worth of everyone’s time. We brainstormed, we sketched, we prototyped and we user-tested. We found ourselves obsessed with the problem we were solving and learned even more from watching users interact with our solution. After 4 days worth of sprinting, we were exhausted and ready for a beer. It’s safe to say that those involved in the design sprint immediately realized the value of this process, which in my eyes made the sprint a complete success. But after sharing our learnings with the rest of the product team, it was evident that not everyone was confident in this process just yet… Without going into too much detail there are some internal constraints that make fully adopting design sprints difficult. This is partially due to our agile engineering timelines but I see it as though I haven’t properly conveyed the value of design sprint. While I strongly believe in the benefits design sprints could have on our products I continue to explore new ways and opportunities of showcasing their business value to appeal to those within Passport."
Medium.com,Innovation & Tech,What to expect in a UX writing interview,UX,https://uxdesign.cc/what-to-expect-in-a-ux-writing-interview-582fcfc6dd70?source=topic_page---------18------------------1," UX writing is a relatively new profession as far as titles go, which can cause some confusion from both parties when it comes to the job interview. Not quite a copywriter, not quite a technical writer, but not quite a UX designer, a UX writer finds themselves floating somewhere between those roles. I’ve been through enough UX writing interview loops now (which can also be called a UX content strategist, or UX copywriter, depending on the company), to know what to expect. Like most interviews, especially for a tech company, the interview loops are long, tiring, and often challenge your mental stamina as much as your aptitude. The industry is finally circling back and correcting errors the early design teams made by omitting copy from the overall design process. In Yuval Keshtcher’s podcast “Writers in Tech” Ep 3, Jared Spool states that in the early days when user guides and products went from analog to digital, technical writers were forgotten, lost in the shuffle along the way. In other words, companies are starting to see the real value of copy, whether it be a well thought out CTA, or a series of introductory screens to increase user engagement, the copy is just as important as the design. Most of us in the UX writing field have come from some sort of writing background, whether it’s from copywriting, content writing, or technical writing. The biggest difference that I’ve seen from UX writing interview loops as opposed to copywriting, is being able to explain your decisions in a design way of thinking. To put it another way, it’s best to think of UX writing as a design position, instead of a writing position. For example, in a recent copywriting interview I had, the company asked me to explain how I came up with my copy for a brochure I wrote. My answer (in a nutshell) was that I looked at some competitors to see how they phrased it, thought about the right words to use considering our brand, and kept editing it until it just “felt right”. That answer would not play out well in a UX writing gig (trust me, I know from first-hand experience). Designers will want to know not only how, but why you arrived at the copy you did. Intuition isn’t as coveted in UX, as much as user research, data, and testing, is. Figure out how and why you arrived at your decisions and you’ll already be ahead of the pack. It’s pretty standard as far as the format. You’ll be asked to do at least one initial phone interview, a writing test, and then usually a half day of interview loops with various members from the company, as well as an on-site presentation of your work. These interview loops will typically consist of: Product and UX designers will typically want to know about your experience working with other designers in previous roles, as well as your take on UX research and design thinking. Other writers will want to know more about your process, your previous writing experience, and how well you might fit with the team. Just when you thought you could escape into an introverted, writing focused role, the industry says “Ha! I got you!” and decides to throw you for an all-day interview loop which includes a slide presentation on your work. It’s tough, it’s nerve-racking, and most of all, it requires a lot of work. In almost every case, they ask you to showcase 2–3 examples of your favorite portfolio pieces, as well as the take-home writing project they gave you before the interview. As mentioned in the previous section, you’ll be asked to not only go over your work, but explain how you arrived at certain copy decisions, as well as some other random questions like: Unfortunately, us UX writers are held to a higher standard of visual presentation (almost as much as UX designers), so I’d suggest staying away from cheesy Powerpoint templates. If designing isn’t your strong suit, go with a simple, clear white and black presentation and leave plenty of white space. Not in theory, but in reality, yes. Not only will you likely be interviewing with UX/UI designers, but your design decisions will be crucial in helping the company find out if you’re the right fit. After all, I strongly believe UX writing is a form of UX design. As a UX writer,you’ll be working on UI’s that will be seen by a lot of people, and you’ll only have seconds of their attention at a time. So understanding some basic design skills is necessary in my opinion, and exactly why I wrote this article about transitioning to more of a design-centric content approach. The good news is that if I can do it, anyone can. Learn Sketch, Adobe XD, or Figma if for nothing else, to show that you can work within the same tools as a UX designer. It will help your career and boost your visual design chops in the process. Yes, and to be clear, you should be prepared to do some work for free. This means working on take home writing projects that will test your design and writing skills, and are designed to see how well (and how fast) you can come up with copy. It typically consists of a project spec that asks you to provide copy on some mock-up UI’s. This might sound easy on the surface, but is usually anything but. The mock-ups are typically bland on purpose, so you’ll need to use some creative firepower to give it some life, meaning you’ll likely have to spend many hours work on the design, as well as the copy.

Oh, and every employer will say something like “Oh, but don’t spend more than 10 hours working on this”.
Yeah, right.
10 hours is nothing in writing…it takes me almost 10 hours to load up my laptop some days, which is only a slight exaggeration.

Writing professionals know that words don’t just come to mind that easily, and we often spend many hours, sometimes days, just trying to get the copy to sound correct. So I say spend as much time as you need to get it right. I can only speak to my personal experience, but I think it’s always a good idea to know and ask how much a company values your position, and copy/content in general. Too often, writers are still thought of as an afterthought in the design process, even though the research proves its impact, and it’s our job to change that perception. A company that already values copy is one you probably will find a lot of success in. It’s a good time to be a writer, if you’re prepared and are up for the task, the opportunities are right there for the taking."
Medium.com,Innovation & Tech,"How I joined Google as a new grad designer, and what I learned from it",UX,https://uxdesign.cc/how-i-joined-google-as-a-new-grad-designer-and-what-i-learned-from-it-525d10c9b796?source=topic_page---------19------------------1,
Medium.com,Innovation & Tech,How being HSP shapes my creative career,UX,https://uxdesign.cc/how-being-hsp-shapes-my-creative-career-54d8ec7e0b1a?source=topic_page---------20------------------1,
