Source,Domain,Heading,Category,URL,Text
Medium.com,Life,The UFC Signs Multi-Million Dollar Deal With Aurora Cannabis to Research CBD Use,Cannabis,https://medium.com/swlh/the-ufc-signs-multi-million-dollar-deal-with-aurora-cannabis-to-research-cbd-use-405e9c9e00a4?source=topic_page---------118------------------1,-
Medium.com,Life,Why Black Women Belong in the Cannabis Industry,Cannabis,https://zora.medium.com/why-black-women-belong-in-the-cannabis-industry-dee3059dfed?source=topic_page---------119------------------1,-
Medium.com,Life,"Headset, Blackbird, and Vangst Among Companies in Talks to Help With Oakland’s Cannabis Equity…",Cannabis,https://medium.com/cheddar/headset-blackbird-and-vangst-among-companies-in-talks-to-help-with-oaklands-cannabis-equity-5feb0d68d530?source=topic_page---------120------------------1,-
Medium.com,Life,Using Marijuana to Get High Dates Back Millennia,Cannabis,https://medium.com/scientific-american/using-ganja-to-get-high-dates-back-millennia-3e26f6946de?source=topic_page---------121------------------1,-
Medium.com,Life,Cannabis and Intellectual Property,Cannabis,https://medium.com/canzeo/cannabis-and-intellectual-property-f1e8bf38e987?source=topic_page---------122------------------1,-
Medium.com,Life,CVS stores in 8 states now carry CBD products,Cannabis,https://thepolicy.us/cvs-stores-in-8-states-now-carry-cbd-products-6286f7c9be17?source=topic_page---------123------------------1,-
Medium.com,Life,The US Ancillary Cannabis Market,Cannabis,https://medium.com/swlh/the-us-ancillary-cannabis-market-782bb1a055b8?source=topic_page---------124------------------1,-
Medium.com,Life,The new runner’s high,Cannabis,https://medium.com/runners-life/the-new-runners-high-5bdd7872cb84?source=topic_page---------125------------------1,-
Medium.com,Life,Can Marijuana Solve the Opioid Epidemic?,Cannabis,https://medium.com/@louisarthuroneill/can-marijuana-solve-the-opioid-epidemic-fa0bd2d7ebc9?source=topic_page---------126------------------1,-
Medium.com,Life,Pesticides in Illegal Pot: A Budding Health Crisis,Cannabis,https://medium.com/marijuana-wire/pesticides-in-illegal-pot-a-budding-health-crisis-dd73526f55dc?source=topic_page---------127------------------1,-
Medium.com,Life,Gov’t Software Giant Accela Partners with CloudPWR to Create Cannabis End-to-End Regulatory System,Cannabis,https://medium.com/cheddar/govt-software-giant-accela-partners-with-cloudpwr-to-create-cannabis-end-to-end-regulatory-system-37ee0b104867?source=topic_page---------128------------------1,-
Medium.com,Life,"CBD and the Hemp Industry Brings Politicians Together for Economic Prosperity, Greater Good",Cannabis,https://medium.com/@jasonroys/cbd-and-the-hemp-industry-brings-politicians-together-for-economic-prosperity-greater-good-46d989230118?source=topic_page---------129------------------1,-
Medium.com,Life,"Cronos Group Expects to Enter U.S. CBD Market by End of Year, CEO Says",Cannabis,https://medium.com/cheddar/cronos-group-expects-to-enter-u-s-cbd-market-by-end-of-year-ceo-says-b414265a26a?source=topic_page---------130------------------1,-
Medium.com,Life,It’s time to legalize marijuana nationwide. Here’s my plan to do it.,Cannabis,https://medium.com/team-gillibrand/its-time-to-legalize-marijuana-nationwide-here-s-my-plan-to-do-it-88a137d78f30?source=topic_page---------131------------------1,-
Medium.com,Life,Pennsylvania’s Governor Wolf Goes After Second Amendment with Recreational Marijuana Bill,Cannabis,https://medium.com/@heatherzamm/pennsylvanias-governor-wolf-goes-after-second-amendment-with-recreational-marijuana-bill-4bc10b3faf4?source=topic_page---------132------------------1,-
Medium.com,Life,Why Women Oppose Marijuana Legalization More Than Men,Cannabis,https://medium.com/@ScottMcGreal/why-women-oppose-marijuana-legalization-more-than-men-9a50f86e878e?source=topic_page---------133------------------1,-
Medium.com,Life,The Racist Origins of The War on Drugs,Cannabis,https://medium.com/@louisarthuroneill/the-racist-origins-of-the-war-on-drugs-1b1e2f068fef?source=topic_page---------134------------------1,-
Medium.com,Life,Is Cannabis Putting Your Bones At Risk?,Cannabis,https://medium.com/the-no-bs-guide-to-medical-cannabis/is-cannabis-putting-your-bones-at-risk-e02f0c381919?source=topic_page---------135------------------1,-
Medium.com,Life,Creating Trust in Cannabis,Cannabis,https://medium.com/swlh/creating-trust-in-cannabis-42b508bf314a?source=topic_page---------136------------------1,-
Medium.com,Life,Does CBD Really Work for Addiction? Intriguing Study Offers Important Clues,Cannabis,https://medium.com/firsttoknow/does-cbd-really-work-for-addiction-intriguing-study-offers-important-clues-1e370a1c18f7?source=topic_page---------137------------------1,-
Medium.com,Life,Mile High Club: The TSA Says YES to CBD on Flights,Cannabis,https://medium.com/@louisarthuroneill/mile-high-club-the-tsa-says-yes-to-cbd-on-flights-87a3704ebb54?source=topic_page---------138------------------1,-
Medium.com,Life,What’s the Difference Between Cannabis Types?,Cannabis,https://medium.com/@jason_27517/whats-the-difference-between-cannabis-types-a4436d02c453?source=topic_page---------139------------------1,-
Medium.com,Life,Impressive joint ventures with big cannabis companies lack the technology to back their valuations,Cannabis,https://keepingstock.net/impressive-joint-ventures-with-big-cannabis-companies-lack-the-technology-to-back-their-valuations-5119a86e9232?source=topic_page---------140------------------1,-
Medium.com,Life,Will Cannabis Be 100% Legalized? Yes—For 3 Obvious Reasons,Cannabis,https://medium.com/the-ascent/will-cannabis-be-100-legalized-yes-for-3-obvious-reasons-c8fad3a6b5d2?source=topic_page---------141------------------1,-
Medium.com,Life,Genomics blazes a trail to improved cannabis cultivation,Cannabis,https://medium.com/proceedings-of-the-national-academy-of-sciences/genomics-blazes-a-trail-to-improved-cannabis-cultivation-3af0e309db34?source=topic_page---------142------------------1,-
Medium.com,Life,Why Exercisers Are Embracing Cannabis,Cannabis,https://elemental.medium.com/why-exercisers-are-embracing-cannabis-96317907bb4c?source=topic_page---------143------------------1,-
Medium.com,Life,Can CBD Really Do All That?,Cannabis,https://medium.com/new-york-times-magazine/can-cbd-really-do-all-that-374fec6a7327?source=topic_page---------144------------------1,-
Medium.com,Life,How Weed Delivery Helped Me Come Out to Mom on Her 70th Birthday,Cannabis,https://thebolditalic.com/how-weed-delivery-helped-me-come-out-to-mom-on-her-70th-birthday-35b31d349f87?source=topic_page---------145------------------1,-
Medium.com,Life,Big Box Stores Are a Costly Ticket to the Top for CBD Companies,Cannabis,https://medium.com/cheddar/big-box-stores-are-a-costly-ticket-to-the-top-for-cbd-companies-103dbc651fd3?source=topic_page---------146------------------1,-
Medium.com,Life,Science Says Marijuana Makes You Skinny — Seriously,Cannabis,https://medium.com/firsttoknow/science-says-marijuana-makes-you-skinny-seriously-f0901114ad07?source=topic_page---------147------------------1,-
Medium.com,Life,Were LSD & Marijuana the Secret to Steve Jobs’ Billions?,Cannabis,https://medium.com/firsttoknow/were-lsd-marijuana-the-secret-to-steve-jobs-billions-222203d63a9d?source=topic_page---------148------------------1,-
Medium.com,Life,Sol Global Embraces ‘Responsible’ Scale With Two California Cannabis Acquisitions,Cannabis,https://medium.com/cheddar/sol-global-embraces-responsible-scale-with-two-california-cannabis-acquisitions-7f9b342fba3?source=topic_page---------149------------------1,-
Medium.com,Life,Duck Donald and Buy The Dip,Cannabis,https://medium.com/@mark_48291/duck-donald-and-buy-the-dip-37135a5c2906?source=topic_page---------150------------------1,-
Medium.com,Life,"Marijuana, Warts and All: What Pot in the Bay Area Did And Didn’t Fix About My Mental Health",Cannabis,https://blog.usejournal.com/marijuana-warts-and-all-what-pot-in-the-bay-area-did-and-didnt-fix-about-my-mental-health-b839ac827804?source=topic_page---------151------------------1,-
Medium.com,Life,Can CBD Soothe The Pain Of A Toothache?,Cannabis,https://medium.com/nordicoil/can-cbd-soothe-the-pain-of-a-toothache-2f4a1a4ec0c5?source=topic_page---------152------------------1,-
Medium.com,Life,Can I Take CBD Oil Products Before Driving — Is it Safe?,Cannabis,https://medium.com/@devincole2112/can-i-take-cbd-oil-products-before-driving-is-it-safe-f016baf003ed?source=topic_page---------153------------------1,-
Medium.com,Life,My Drug Dealer’s Snake,Cannabis,https://gay.medium.com/my-drug-dealers-snake-fbca737f4272?source=topic_page---------154------------------1,-
Medium.com,Life,How Biotech Went From ‘No Way’ to Payday in the Cannabis Business,Cannabis,https://medium.com/mit-technology-review/how-biotech-went-from-no-way-to-payday-in-the-cannabis-business-8affe6595a9?source=topic_page---------155------------------1,-
Medium.com,Life,The Munchies Paradox,Cannabis,https://elemental.medium.com/the-munchies-paradox-885ca3cb27f4?source=topic_page---------156------------------1,-
Medium.com,Life,A Love Letter to Cannabis,Cannabis,https://medium.com/@sameripley/a-love-letter-to-cannabis-f8ad0a86ffa9?source=topic_page---------157------------------1,-
Medium.com,Life,The STATES Act could be bigger for cannabis than Sessions’ resignation,Cannabis,https://thepolicy.us/the-states-act-could-be-bigger-for-cannabis-than-sessions-resignation-e7cd9a2e0168?source=topic_page---------158------------------1,-
Medium.com,Life,Alaska’s marijuana laws keep getting greener,Cannabis,https://medium.com/@Thomas_Brown./alaskas-marijuana-laws-keep-getting-greener-4e1cffa9a91f?source=topic_page---------159------------------1,-
Medium.com,Life,She Shoulda Said No / Wild Weed (1949),Cannabis,https://medium.com/@solnikkar/she-should-said-no-wild-weed-1949-d4d3bd87abaf?source=topic_page---------160------------------1,-
Medium.com,Life,Why State-By-State Marijuana Legalization Is a Mess,Cannabis,https://medium.com/rollingstone/why-state-by-state-marijuana-legalization-is-a-mess-7eab9b311e3e?source=topic_page---------161------------------1,-
Medium.com,Life,How to Use Cannabis Tax Dollars to Address Injustice,Cannabis,https://medium.com/@jennifergumer/how-to-use-cannabis-tax-dollars-to-address-injustice-54ef2fc00b5c?source=topic_page---------162------------------1,-
Medium.com,Life,CBD — The Ultimate Hangover Cure,Cannabis,https://medium.com/leafbulb/cbd-the-ultimate-hangover-cure-4a7c2e94be2d?source=topic_page---------163------------------1,-
Medium.com,Life,The Easiest $220 I Ever Made,Cannabis,https://medium.com/@rosemary.summers/the-easiest-220-i-ever-made-a283069130a8?source=topic_page---------164------------------1,-
Medium.com,Life,A Cannabis-Based Drug Is Going to Change Lives,Cannabis,https://elemental.medium.com/a-cannabis-based-drug-is-going-to-change-lives-3f1374e89adc?source=topic_page---------165------------------1,-
Medium.com,Life,Is CBD Oil Legal In All 50 States? | In Which States is CBD Legal?,Cannabis,https://medium.com/@a420x247/is-cbd-oil-legal-in-all-50-states-in-which-states-is-cbd-legal-b99bb1b2ae8a?source=topic_page---------166------------------1,-
Medium.com,Life,MIT and Harvard secure $9 million donation designed to assess marijuana impact on health,Cannabis,https://medium.com/@jeffreyhill2/mit-and-harvard-secure-9-million-donation-designed-to-assess-marijuana-impact-on-health-91306771c9d0?source=topic_page---------167------------------1,-
Medium.com,Life,Make Cannabis Legal Again,Cannabis,https://medium.com/@kerrisb3/a-renown-general-social-survey-from-2018-shows-that-61-of-americans-feel-that-cannabis-should-be-a5d91e487606?source=topic_page---------168------------------1,-
Medium.com,Life,What will it take to tame the Wild West of CBD?,Cannabis,https://medium.com/@admin_83254/what-will-it-take-to-tame-the-wild-west-of-cbd-764218b8a4cf?source=topic_page---------169------------------1,-
Medium.com,Life,Why I Started Using CBD,Cannabis,https://medium.com/@queenofhaiku/why-i-started-using-cbd-8565fb01f9b2?source=topic_page---------170------------------1,-
Medium.com,Life,How you can Differentiate Between Hemp and Marijuana,Cannabis,https://medium.com/@devincole2112/how-you-can-differentiate-between-hemp-and-marijuana-dafbe2e7ff22?source=topic_page---------171------------------1,-
Medium.com,Life,One Good Night Does Not a Randomized Trial Make,Cannabis,https://medium.com/1-one-infinity/one-good-night-does-not-a-randomized-trial-make-6b2478f8c1e6?source=topic_page---------172------------------1,-
Medium.com,Life,Your 2019 Guide to Investing in Hemp,Cannabis,https://medium.com/@mark_48291/your-2019-guide-to-investing-in-hemp-45f49c3a4369?source=topic_page---------173------------------1,-
Medium.com,Life,Willie Nelson: The High Life,Cannabis,https://medium.com/rollingstone/willie-nelson-the-high-life-2e57ddd5508f?source=topic_page---------174------------------1,-
Medium.com,Life,Cannabis Pioneer Makes High-End Edibles for ‘Foodie Market’,Cannabis,https://medium.com/cheddar/cheddar-exclusive-cronos-group-co-founder-launches-edibles-company-pantry-759086463066?source=topic_page---------175------------------1,-
Medium.com,Life,PR Pro Pours Expertise Into ‘Cannabis for Dummies’ Book,Cannabis,https://medium.com/cheddar/communications-professional-pours-expertise-into-new-cannabis-for-dummies-book-589b4731ab7d?source=topic_page---------176------------------1,-
Medium.com,Life,"Conventional Retail, the next frontier for Cannabis/CBD.",Cannabis,https://medium.com/@jeffreyhill2/conventional-retail-the-next-frontier-for-cannabis-cbd-9b349565451b?source=topic_page---------177------------------1,-
Medium.com,Life,Why this 4/20 could be the best one yet for cannabis enterprises,Cannabis,https://medium.com/leafbulb/why-this-4-20-could-be-the-best-one-yet-for-cannabis-enterprises-12af1a15624a?source=topic_page---------178------------------1,-
Medium.com,Life,The Pros and Cons of a Homemade Marijuana Brownie at a Dinner Party,Cannabis,https://medium.com/@MrBaker1/the-pros-and-cons-of-a-homemade-marijuana-brownie-at-a-dinner-party-1445d5f92b1a?source=topic_page---------179------------------1,-
Medium.com,Life,A Non-Drinker Discovers the Joy of an SF Cannabis Lounge,Cannabis,https://thebolditalic.com/a-non-drinker-discovers-the-joy-of-an-sf-cannabis-lounge-771605c63feb?source=topic_page---------180------------------1,-
Medium.com,Life,‘Grass Is Greener’: Fab 5 Freddy Tackles Pot’s Racist History in New Netflix Doc,Cannabis,https://medium.com/rollingstone/grass-is-greener-fab-5-freddy-tackles-pot-s-racist-history-in-new-netflix-doc-7fc749d1ec7e?source=topic_page---------181------------------1,-
Medium.com,Life,Cannabis is the best blockchain use case yet,Cannabis,https://medium.com/@jockinkp/cannabis-is-the-best-blockchain-use-case-yet-d307c376c5d2?source=topic_page---------182------------------1,-
Medium.com,Life,Current Legality Status and Future Of Cannabis Worldwide,Cannabis,https://medium.com/@devincole2112/current-legality-status-and-future-of-cannabis-worldwide-11ab0e2d3ba4?source=topic_page---------183------------------1,-
Medium.com,Life,CBD oil: a budding market?,Cannabis,https://medium.com/street-voice/cbd-oil-a-budding-market-cd8281994771?source=topic_page---------184------------------1,-
Medium.com,Life,Why the VA Owes it to Veterans to Study Cannabis,Cannabis,https://medium.com/@jennifergumer/why-the-va-owes-it-to-veterans-to-study-cannabis-74d39757a8d4?source=topic_page---------185------------------1,-
Medium.com,Life,Carl’s Jr. Tests Out New CBD Burger,Cannabis,https://medium.com/anavii-market/carls-jr-tests-out-new-cbd-burger-3e25f61220df?source=topic_page---------186------------------1,-
Medium.com,Life,Michigan makes marijuana legal —and businesses in other states want in,Cannabis,https://thepolicy.us/michigan-makes-marijuana-legal-and-businesses-in-other-states-want-in-779c687ae6a5?source=topic_page---------187------------------1,-
Medium.com,Life,Starting a cannabis business with limited funding,Cannabis,https://medium.com/swlh/starting-a-cannabis-business-with-limited-funding-ef36701f69a5?source=topic_page---------188------------------1,-
Medium.com,Life,Cannabis & Pharmaceuticals: Following ThMoney,Cannabis,https://medium.com/@darbyhemp/cannabis-pharmaceuticals-following-thmoney-50df9769fbc2?source=topic_page---------189------------------1,-
Medium.com,Life,The overpromise of pot in Oklahoma,Cannabis,https://medium.com/@FOTP/the-overpromise-of-pot-6de96daf3211?source=topic_page---------190------------------1,-
Medium.com,Life,Cannabis Event 101: Hosting a Cannabis event in Massachusetts,Cannabis,https://medium.com/eventhi/cannabis-event-101-hosting-a-cannabis-event-in-massachusetts-e4a47af9c3b7?source=topic_page---------191------------------1,-
Medium.com,Life,"Marijuana Has Conquered America, But The War on Pot Is Far From Over",Cannabis,https://medium.com/marijuana-wire/marijuana-has-conquered-america-but-the-war-on-pot-is-far-from-over-56fd5e1553d3?source=topic_page---------192------------------1,-
Medium.com,Life,On cannabis hyperemesis: the disorder caused by chronic marijuana use,Cannabis,https://medium.com/@falsabeh/on-cannabis-hyperemesis-the-disorder-caused-by-chronic-marijuana-use-a88a2c1c2267?source=topic_page---------193------------------1,-
Medium.com,Life,Hemp Descheduled in Texas! Paves the way for Senate Bill 1240,Cannabis,https://medium.com/@greenlotushemp/hemp-descheduled-in-texas-paves-the-way-for-senate-bill-1240-b7f422699eab?source=topic_page---------194------------------1,-
Medium.com,Life,Your Guide to Legit CBD,Cannabis,https://elemental.medium.com/your-guide-to-legit-cbd-562553672e9d?source=topic_page---------195------------------1,-
Medium.com,Life,Is it Safe to Take CBD with Other Medications? CBD Drug Interactions Explained,Cannabis,https://medium.com/cbd-origin/is-it-safe-to-take-cbd-with-other-medications-cbd-drug-interactions-explained-446ed50b4758?source=topic_page---------196------------------1,-
Medium.com,Life,CO2 Selectability,Cannabis,https://medium.com/@VitalisET/co2-selectability-109c02a7764a?source=topic_page---------197------------------1,-
Medium.com,Life,What’s the Difference Between THC and CBD?,Cannabis,https://medium.com/jason-budd/whats-the-difference-between-thc-and-cbd-a37a29d1e7ae?source=topic_page---------198------------------1,-
Medium.com,Life,CBD is the New Kombucha,Cannabis,https://medium.com/@tkmaclean/cbd-is-the-new-kombucha-8df95f5a070d?source=topic_page---------199------------------1,-
Medium.com,Life,Avoiding Over-Centralization of American Hemp,Cannabis,https://medium.com/@darbyhemp/avoiding-over-centralization-of-american-hemp-52ba91b5bc58?source=topic_page---------200------------------1,-
Medium.com,Life,US House Committee Advances Bill to Protect Banks Serving Cannabis Industry,Cannabis,https://medium.com/citizen-truth/us-house-committee-advances-bill-to-protect-banks-serving-cannabis-industry-ed8b6a2518d2?source=topic_page---------201------------------1,-
Medium.com,Life,Cryptocurrency May Be The Unique Solution For Cannabis Tax Payments,Cannabis,https://medium.com/@cryptblock/cryptocurrency-may-be-the-unique-solution-for-cannabis-tax-payments-822707c46526?source=topic_page---------202------------------1,-
Medium.com,Life,The Public Health Impact of Cannabis’s Fractured Legal Status,Cannabis,https://medium.com/@jennifergumer/the-public-health-impact-of-cannabiss-fractured-legal-status-ffd42a0f0864?source=topic_page---------203------------------1,-
Medium.com,Life,The Stigma of Marijuana use through Pop Culture,Cannabis,https://medium.com/@Vanessa54160950/the-stigma-of-marijuana-use-through-pop-culture-bb9a40a0552d?source=topic_page---------204------------------1,-
Medium.com,Life,The Need for Weed: Why Wall Street Is Getting Hooked on Cannabis,Cannabis,https://medium.com/financial-times/the-need-for-weed-why-wall-street-is-getting-hooked-on-cannabis-a5b12cda227b?source=topic_page---------205------------------1,-
Medium.com,Life,Politicians Move to Give Cannabis Industry Access to Banking,Cannabis,https://medium.com/cheddar/key-house-committee-endorses-banking-access-for-cannabis-businesses-b64f70f79df5?source=topic_page---------206------------------1,-
Medium.com,Life,Can High Times Survive in the Age of Vaping?,Cannabis,https://onezero.medium.com/can-the-bible-of-weed-survive-in-the-age-of-vaping-6a1baf1b7e4e?source=topic_page---------207------------------1,-
Medium.com,Life,Can Cannabis Cause Paranoia?,Cannabis,https://medium.com/quality-cbd/can-cannabis-cause-paranoia-68b21a9adc8d?source=topic_page---------208------------------1,-
Medium.com,Life,Cannabis & Cryptocurrency: Cryptocurrencies Powering The Marijuana Industry,Cannabis,https://medium.com/buidl-school/cannabis-cryptocurrency-cryptocurrencies-powering-the-marijuana-industry-30be27df2d4f?source=topic_page---------209------------------1,-
Medium.com,Life,Curating cannabis with your personal data,Cannabis,https://roughdraft.review/curating-cannabis-with-your-personal-data-7853c478a2d7?source=topic_page---------210------------------1,-
Medium.com,Life,"OTD in History… March 22, 1765, Britain institutes the Stamp Act first direct tax on the colonies",Cannabis,https://medium.com/@BonnieKGoodman/otd-in-history-march-22-1765-britain-institutes-the-stamp-act-first-direct-tax-on-the-colonies-beaad0272c97?source=topic_page---------211------------------1,-
Medium.com,Life,What Is CBD Oil?,Cannabis,https://medium.com/genius-labs-cbd-wholesale/what-is-cbd-oil-cea1274b2b99?source=topic_page---------212------------------1,-
Medium.com,Life,Marijuana Legalization Just Suffered a Huge Setback,Cannabis,https://medium.com/cheddar/marijuana-legalization-just-suffered-a-huge-setback-6a95d225feab?source=topic_page---------213------------------1,-
Medium.com,Life,Weed The People,Cannabis,https://medium.com/@chrisyoumans/weed-the-people-ed2946333f0d?source=topic_page---------214------------------1,-
Medium.com,Life,10 Reasons Why the Cannabis Industry Needs Experience Design,Cannabis,https://medium.com/smolder/10-reasons-why-the-cannabis-industry-needs-experience-design-248fb78fc653?source=topic_page---------215------------------1,-
Medium.com,Life,Optimal CBD Dosing: Everything You Need to Know,Cannabis,https://medium.com/better-humans/optimal-cbd-dosing-everything-you-need-to-know-fee4a85ce0db?source=topic_page---------216------------------1,-
Medium.com,Life,Cannabis Investing Can Jeopardize Federal Security Clearance,Cannabis,https://medium.com/cheddar/cannabis-investing-%E3%83%BC-not-just-use-%E3%83%BC-can-jeopardize-federal-security-clearance-55f07d105a36?source=topic_page---------217------------------1,-
Medium.com,Life,Mary’s Nutritionals CEO Has a Plan to Stand Out in Crowded CBD Market,Cannabis,https://medium.com/cheddar/marys-nutritionals-ceo-free-people-partnership-will-help-brand-stand-out-62364be2ed51?source=topic_page---------218------------------1,-
Medium.com,Life,Cannabis Company SOL Global Invests Millions in Tennessee Hemp Producer,Cannabis,https://medium.com/cheddar/cannabis-company-sol-global-invests-in-tennessee-hemp-producer-bl%C3%BChen-botanicals-1cbd4cc994ed?source=topic_page---------219------------------1,-
Medium.com,Life,"Green Growth Brands Has Ambitious Plans for Malls, Brand Partnerships",Cannabis,https://medium.com/cheddar/one-year-out-green-growth-brands-has-ambitious-plans-for-malls-brand-partnerships-1563410d0353?source=topic_page---------220------------------1,-
Medium.com,Life,5 Things Cannabusiness Owners Should Expect From Federal Marijuana Legalization — TheBluntness,Cannabis,https://medium.com/@thebluntness1/5-things-cannabusiness-owners-should-expect-from-federal-marijuana-legalization-thebluntness-cea462364001?source=topic_page---------221------------------1,-
Medium.com,Life,Getting starting in the marijuana industry. Everything you need to know to open up a dispensary.,Cannabis,https://medium.com/@alexseo/getting-starting-in-the-marijuana-industry-everything-you-need-to-know-to-open-up-a-dispensary-8b7af445ecc6?source=topic_page---------222------------------1,-
Medium.com,Life,Marijuana in the Workplace? Sometimes You Can’t Just Say No.,Cannabis,https://medium.com/inc./marijuana-in-the-workplace-sometimes-you-cant-just-say-no-7adcaa6b82e0?source=topic_page---------223------------------1,-
Medium.com,Life,7 Days of CBD,Cannabis,https://medium.com/@victoriamyr/7-days-of-cbd-9996e7bcaaa6?source=topic_page---------224------------------1,-
Medium.com,Life,CBD is Breaking Down Marijuana Stereotypes,Cannabis,https://medium.com/@stephanie.j.zhu/cbd-is-breaking-down-marijuana-stereotypes-eb7643258c51?source=topic_page---------225------------------1,-
Medium.com,Life,The Great Cannabis Experiment,Cannabis,https://medium.com/family-friendly-a-traceybyfire-publication/the-great-cannabis-experiment-944dbab524ae?source=topic_page---------226------------------1,-
Medium.com,Life,Can CBD Help Relieve the Symptoms of Arthritis?,Cannabis,https://medium.com/quality-cbd/can-cbd-help-relieve-the-symptoms-of-arthritis-98ac655adb1d?source=topic_page---------227------------------1,-
Medium.com,Life,Investors ask what’s next for cannabis post-legalization,Cannabis,https://thepolicy.us/investors-ask-whats-next-for-cannabis-post-legalization-1d58702ab6d7?source=topic_page---------228------------------1,-
Medium.com,Life,How to Launch Your CBD Business in 2019 and Get White Label Wholesale CBD Products from Top…,Cannabis,https://medium.com/@mahfuz_cbd/how-to-launch-your-cbd-business-in-2019-and-get-white-label-wholesale-cbd-products-from-top-b2b7d8005228?source=topic_page---------229------------------1,-
Medium.com,Life,Recreational Cannabis & Medicinal Cannabis: What’s The Difference?,Cannabis,https://medium.com/@ravinderdeolcom/recreational-cannabis-medicinal-cannabis-whats-the-difference-49cc918afde0?source=topic_page---------230------------------1,-
