Source,Domain,Heading,Category,URL,Text
Medium.com,Life,Why Isn’t CBD Legal Yet?,Cannabis,https://medium.com/rollingstone/why-isnt-cbd-legal-yet-9738ecda7bf1?source=topic_page---------231------------------1,-
Medium.com,Life,Five Reasons Why I Prefer CBD to THC,Cannabis,https://medium.com/jason-budd/five-reasons-why-i-prefer-cbd-to-thc-cce324d0e16?source=topic_page---------232------------------1,-
Medium.com,Life,2018 Hemp Report Reveals Huge Expansion To US Hemp Acres,Cannabis,https://medium.com/@ministryofhemp/2018-hemp-report-reveals-huge-expansion-to-us-hemp-acres-aafd67150497?source=topic_page---------233------------------1,-
Medium.com,Life,Rising High: GM Yeast Generates Known and Novel Marijuana Compounds,Cannabis,https://medium.com/scientific-american/rising-high-gm-yeast-generates-known-and-novel-marijuana-compounds-b76454f3d835?source=topic_page---------234------------------1,-
Medium.com,Life,What Is CBD and Can It Really Help Your Anxiety?,Cannabis,https://medium.com/right-as-rain/what-is-cbd-and-can-it-really-help-your-anxiety-b5e80d45a826?source=topic_page---------235------------------1,-
Medium.com,Life,Quitting Tobacco with “Tea”,Cannabis,https://medium.com/jason-budd/quitting-tobacco-with-tea-4f693a43e377?source=topic_page---------236------------------1,-
Medium.com,Life,Scientists Are Making THC and CBD Without Marijuana,Cannabis,https://onezero.medium.com/scientists-are-making-thc-and-cbd-without-marijuana-5c781922c997?source=topic_page---------237------------------1,-
Medium.com,Life,CBD and Pets: Is my dog going to be high?,Cannabis,https://medium.com/tail-talk/cbd-and-pets-is-my-dog-going-to-be-high-29f192828d9e?source=topic_page---------238------------------1,-
Medium.com,Life,How good is the evidence for medical marijuana?,Cannabis,https://medium.com/@wayne.haythorn/how-good-is-the-evidence-for-medical-marijuana-449bc71f924a?source=topic_page---------239------------------1,-
Medium.com,Life,Investor interest is growing in these rising cannabis industry players,Cannabis,https://keepingstock.net/investor-interest-is-growing-in-these-rising-cannabis-industry-players-a6d6ef95ab33?source=topic_page---------240------------------1,-
Medium.com,Life,Marijuana: Misconstrued And Misunderstood,Cannabis,https://medium.com/@aidan.ardell/marijuana-misconstrued-and-misunderstood-6e867519e52c?source=topic_page---------241------------------1,-
Medium.com,Life,What Are The Differences Between CBD & THC? The Most Comprehensive Guide Ever!,Cannabis,https://medium.com/@ravinderdeolcom/what-are-the-differences-between-cbd-thc-the-most-comprehensive-guide-ever-b4472d7438dc?source=topic_page---------242------------------1,-
Medium.com,Life,Can CBD Help Beat Cancer?,Cannabis,https://medium.com/@geniuscbd/can-cbd-help-beat-cancer-e32e82d198de?source=topic_page---------243------------------1,-
Medium.com,Life,"CBD Benefits, Crack Drown and Everything You Need to Know",Cannabis,https://medium.com/@healthyhappylifestyle/cbd-benefits-crack-drown-and-everything-you-need-to-know-d788d82616e4?source=topic_page---------244------------------1,-
Medium.com,Life,Can Cannabis Cure Psychosis?,Cannabis,https://medium.com/@gidmk/can-cannabis-cure-psychosis-383017d55894?source=topic_page---------245------------------1,-
Medium.com,Life,The Cost of Prohibition: How Marijuana Charges have Burdened Americans,Cannabis,https://medium.com/@nelliottfc/the-cost-of-prohibition-how-marijuana-charges-have-burdened-americans-986cda15eaa1?source=topic_page---------246------------------1,-
Medium.com,Life,Moving On From Civil Disobedience,Cannabis,https://medium.com/@JungleStrike/moving-on-from-civil-disobedience-9febefa9c5f6?source=topic_page---------247------------------1,-
Medium.com,Life,Can You Top Autoflowers?,Cannabis,https://medium.com/@fast_buds/can-you-top-autoflowers-70e0a4f25097?source=topic_page---------248------------------1,-
Medium.com,Life,7 Tips and Tricks to Maximize Yields in Autoflowers,Cannabis,https://medium.com/@fast_buds/7-tips-and-tricks-to-maximize-yields-in-autoflowers-71eabe08bfec?source=topic_page---------249------------------1,-
Medium.com,Life,Making sense of WHO’s recent recommendations on cannabis,Cannabis,https://medium.com/@j.duclos/making-sense-of-whos-recent-recommendations-on-cannabis-e03e9762d346?source=topic_page---------250------------------1,-
Medium.com,Life,"If This Is Millennials’ Favorite Stock, I Feel Sorry for Them",Cannabis,https://medium.com/the-motley-fool/if-this-is-millennials-favorite-stock-i-feel-sorry-for-them-ab4237bdeb2e?source=topic_page---------251------------------1,-
Medium.com,Life,What the Schizophrenic Legal Status of CBD Reveals About the Underlying Madness of the Controlled…,Cannabis,https://medium.com/@jennifergumer/what-the-schizophrenic-legal-status-of-cbd-reveals-about-the-underlying-madness-of-the-controlled-dbce44de5989?source=topic_page---------252------------------1,-
Medium.com,Life,How CBD Can Improve All Aspects of Health,Cannabis,https://medium.com/@loyalnyk/how-cbd-can-improve-all-aspects-of-health-cecf0bc0741f?source=topic_page---------253------------------1,-
Medium.com,Life,Why You Can’t Grow Weed in Canada That Won’t Get You High,Cannabis,https://medium.com/@jdmoffatt/why-you-cant-grow-weed-in-canada-that-won-t-get-you-high-49a57bb5b9d4?source=topic_page---------254------------------1,-
Medium.com,Life,Is Australia moving toward marijuana legalisation?,Cannabis,https://medium.com/@louisarthuroneill/is-australia-moving-toward-marijuana-legalisation-c92cbf5eec8f?source=topic_page---------255------------------1,-
Medium.com,Life,Are Those Avocados Indoor?,Cannabis,https://medium.com/@tinabugg99/are-those-avocados-indoor-6696b1d4ee55?source=topic_page---------256------------------1,-
Medium.com,Life,Do Different Strains of Marijuana Cause Different Highs?,Cannabis,https://elemental.medium.com/do-different-strains-of-marijuana-cause-different-highs-3efdc41f00c1?source=topic_page---------257------------------1,-
Medium.com,Life,A Comprehensive Guide to High CBD Strains,Cannabis,https://medium.com/@kataustinwriting/a-comprehensive-guide-to-high-cbd-strains-dbcfe580ca07?source=topic_page---------258------------------1,-
Medium.com,Life,Common CBD Side Effects & Why They Occur,Cannabis,https://medium.com/@kataustinwriting/common-cbd-side-effects-why-they-occur-cf449cc9b1d1?source=topic_page---------259------------------1,-
Medium.com,Life,Canada provides ripe opportunities for cannabis companies looking to go public,Cannabis,https://keepingstock.net/canada-provides-ripe-opportunities-for-cannabis-companies-looking-to-go-public-a6b036cb3be1?source=topic_page---------260------------------1,-
Medium.com,Life,"10 Things to Know Before You Buy CBD Online (or anywhere, really)",Cannabis,https://medium.com/cbd-origin/10-things-to-know-before-you-buy-cbd-online-or-anywhere-really-db9813f32884?source=topic_page---------261------------------1,-
Medium.com,Life,How to Make a Millennial Feel Cozy in Just One Beverage,Cannabis,https://medium.com/the-new-york-times/how-to-make-a-millennial-feel-cozy-in-just-one-beverage-22637129ba06?source=topic_page---------262------------------1,-
Medium.com,Life,Chick and Egg: Redux,Cannabis,https://medium.com/@addictiondocMD/chick-and-egg-redux-d25e4d22ca58?source=topic_page---------263------------------1,-
Medium.com,Life,More Reefer Madness Isn’t What We Need Today,Cannabis,https://medium.com/@mashafalkov/more-reefer-madness-isnt-what-we-need-today-409025335fd2?source=topic_page---------264------------------1,-
Medium.com,Life,8 Cannabis Trends to Watch in 2019,Cannabis,https://medium.com/@garybizzo/8-cannabis-trends-to-watch-in-2019-88062350edfd?source=topic_page---------265------------------1,-
Medium.com,Life,Can the State Help Oakland’s Equity Program? | East Bay Express,Cannabis,https://medium.com/@ebanksrusby/can-the-state-help-oaklands-equity-program-east-bay-express-466674f5088b?source=topic_page---------266------------------1,-
Medium.com,Life,I went to a Church of Cannabis,Cannabis,https://medium.com/the-ascent/i-went-to-a-church-of-cannabis-d168ac352ab4?source=topic_page---------267------------------1,-
Medium.com,Life,Do you Believe in “CBD Only?”,Cannabis,https://medium.com/@redactiondesormeaux/do-you-believe-in-cbd-only-45a4ec75551c?source=topic_page---------268------------------1,-
Medium.com,Life,The Story That Defined How A Generation Would View Marijuana,Cannabis,https://medium.com/@H.C.Guida/the-story-that-defined-how-a-generation-would-view-marijuana-f9097efe2c64?source=topic_page---------269------------------1,-
Medium.com,Life,2018 Farm Bill Legalizes Hemp In USA,Cannabis,https://medium.com/@ministryofhemp/2018-farm-bill-legalizes-hemp-in-usa-d96d0e8b2dc5?source=topic_page---------270------------------1,-
Medium.com,Life,"MMJ — Lets step back a minute, how did we get here?",Cannabis,https://medium.com/@jeffreyhill2/mmj-lets-step-back-a-minute-how-did-we-get-here-2d9a509c6a71?source=topic_page---------271------------------1,-
Medium.com,Life,Conservative Alaska is leading the nation in progressive Marijuana laws.,Cannabis,https://blog.usejournal.com/conservative-alaska-is-leading-the-nation-in-progressive-marijuana-laws-7c50df446387?source=topic_page---------272------------------1,-
Medium.com,Life,How the Pot Movement Changed in 2018,Cannabis,https://medium.com/rollingstone/how-the-pot-movement-changed-in-2018-bfbcb84d0b83?source=topic_page---------273------------------1,-
Medium.com,Life,Cannabis: A Psychedelic Medicine?,Cannabis,https://medium.com/@leo_raderman/cannabis-a-psychedelic-medicine-c72de93ede05?source=topic_page---------274------------------1,-
Medium.com,Life,5 Reasons Marijuana Stocks Could Lose You Money in 2019,Cannabis,https://medium.com/the-motley-fool/5-reasons-marijuana-stocks-could-lose-you-money-in-2019-f72345c94175?source=topic_page---------275------------------1,-
Medium.com,Life,The U.S. Federal Government: The Biggest Opioid Cartel In the World,Cannabis,https://medium.com/@jackson.lowry.films/the-u-s-federal-government-the-biggest-opioid-cartel-in-the-world-33c07d9feedc?source=topic_page---------276------------------1,-
Medium.com,Life,Ask an Alaskan Swamp Rat: How did a red state like Alaska legalize marijuana?,Cannabis,https://medium.com/@Thomas_Brown./ask-an-alaskan-swamp-rat-how-did-a-red-state-like-alaska-legalize-marijuana-2c3b9b0a5f82?source=topic_page---------277------------------1,-
Medium.com,Life,Can CBD Solve Your Skin Problems?,Cannabis,https://elemental.medium.com/can-cbd-solve-your-skin-problems-33713e723520?source=topic_page---------278------------------1,-
Medium.com,Life,The Hemp Boom Begins,Cannabis,https://medium.com/@jghousecoy/the-hemp-boom-begins-1842b3e93017?source=topic_page---------279------------------1,-
Medium.com,Life,"Marijuana, Menopause, and Me",Cannabis,https://medium.com/s/the-long-middle/marijuana-menopause-and-me-be3f77700f14?source=topic_page---------280------------------1,-
Medium.com,Life,A Plea for Cannabis in Hospitals,Cannabis,https://healthcareinamerica.us/a-plea-for-cannabis-in-hospitals-4497c1048a5a?source=topic_page---------281------------------1,-
Medium.com,Life,What the Dutch Can Teach the World About Cannabis,Cannabis,https://medium.com/financial-times/what-the-dutch-can-teach-the-world-about-cannabis-c70fcba5c88e?source=topic_page---------282------------------1,-
Medium.com,Life,Should Brazil Legalize Marijuana?,Cannabis,https://brightthemag.com/health-brazil-marijuana-legalization-43b3f211104d?source=topic_page---------283------------------1,-
Medium.com,Life,My Life-Changing Visit to a Cannabis Clinic,Cannabis,https://thebolditalic.com/my-life-changing-visit-to-a-cannabis-clinic-f14e12c1cb90?source=topic_page---------284------------------1,-
Medium.com,Life,Why Veterans With PTSD Are Turning To Cannabis,Cannabis,https://medium.com/the-establishment/why-veterans-with-ptsd-are-turning-to-cannabis-2a9049593806?source=topic_page---------285------------------1,-
Medium.com,Life,How My Cannabis Prescription Made Me Realize That Weed Should Be Decriminalized,Cannabis,https://medium.com/theintercept/how-my-cannabis-prescription-made-me-realize-that-weed-should-be-decriminalized-9078d6a96476?source=topic_page---------286------------------1,-
Medium.com,Life,Cannabis farmers hidden in India’s Himalayas,Cannabis,https://medium.com/@AJEnglish/cannabis-farmers-hidden-in-indias-himalayas-c9d2ce7bb1d9?source=topic_page---------287------------------1,-
Medium.com,Life,Why I Changed My Stance on Marijuana,Cannabis,https://medium.com/@SenSchumer/why-i-changed-my-stance-on-marijuana-2fde12086c35?source=topic_page---------288------------------1,-
Medium.com,Life,Medical Marijuana: A Beginner’s Guide,Cannabis,https://medium.com/rollingstone/medical-marijuana-a-beginners-guide-c5c113ba71cf?source=topic_page---------289------------------1,-
