Source,Domain,Heading,Category,URL,Text
Medium.com,Life,There Is Almost No Evidence That Cannabis Will Improve Mental Health Conditions,Cannabis,https://medium.com/@jbrandonlowry/cannabis-and-mental-health-3724d0e352f4?source=topic_page---------0------------------1,-
Medium.com,Life,Easiest 10 Minute ‘Agile’ Cannabis Butter or Coconut Oil Recipe,Cannabis,https://medium.com/@timboucher/easiest-10-minute-agile-cannabis-butter-or-coconut-oil-recipe-f060c73e1f17?source=topic_page---------1------------------1,-
Medium.com,Life,Weed Everything: Meet the owners of the trademark for “Weed”,Cannabis,https://medium.com/hngry/weed-everything-meet-the-owners-of-the-trademark-for-weed-90e58efa224d?source=topic_page---------2------------------1,-
Medium.com,Life,The Impact of Marijuana Legalization on Traffic Deaths: A Synthetic Control Approach,Cannabis,https://towardsdatascience.com/the-impact-of-marijuana-legalization-on-traffic-deaths-a-synthetic-control-approach-420a36c5e8eb?source=topic_page---------4------------------1,-
Medium.com,Life,What social cannabis consumption looks like at Lowell Cafe,Cannabis,https://medium.com/hngry/what-social-cannabis-consumption-looks-like-at-lowell-cafe-519ba61e7d9f?source=topic_page---------5------------------1,-
Medium.com,Life,This Single Mama Wants To Try Smoking Weed,Cannabis,https://medium.com/honestly-yours/this-single-mama-wants-to-try-smoking-weed-4d11c5a8700f?source=topic_page---------6------------------1,-
Medium.com,Life,How to Join the Green New Silicon Valley,Cannabis,https://medium.com/@bretkavanaugh/how-to-join-the-green-new-silicon-valley-de6f09360841?source=topic_page---------7------------------1,-
Medium.com,Life,"Yes, Cannabis Can Cause Catastrophic Schizophrenia.",Cannabis,https://medium.com/swlh/yes-cannabis-can-cause-catastrophic-schizophrenia-9c305ffb334?source=topic_page---------8------------------1,-
Medium.com,Life,"Cannabis should be leveraged to create meaningful, green jobs where they are most needed",Cannabis,https://medium.com/@j.duclos/cannabis-should-be-leveraged-to-create-meaningful-green-jobs-where-they-are-most-needed-ae21178c5666?source=topic_page---------9------------------1,-
Medium.com,Life,Medical Cannabis,Cannabis,https://medium.com/@lukewiese/medical-cannabis-fc4ab43f44bb?source=topic_page---------10------------------1,-
Medium.com,Life,Can Eating Cannabis Edibles Make You Lazy?,Cannabis,https://medium.com/the-soul-tribe/can-eating-cannabis-edibles-make-you-a-lazy-person-cb0da3dd740?source=topic_page---------11------------------1,-
Medium.com,Life,Hemp Bathing,Cannabis,https://medium.com/@nataliebehring/hemp-bathing-1050f9bee41?source=topic_page---------12------------------1,-
Medium.com,Life,Evolution of the endocannabinoid system,Cannabis,https://medium.com/@wayne.haythorn/evolution-of-the-endocannabinoid-system-bdecff1d9826?source=topic_page---------13------------------1,-
Medium.com,Life,Is Canada New Legal Framework Regulating Cannabis Use Too Restrictive? Some Expert Think So.,Cannabis,https://medium.com/@strategicoutlook/is-canada-new-legal-framework-regulating-cannabis-use-too-restrictive-some-expert-think-so-bb2062a1e6a0?source=topic_page---------14------------------1,-
Medium.com,Life,Some Women Are Using Weed to Have Better Sex,Cannabis,https://elemental.medium.com/some-women-are-using-weed-to-have-better-sex-f6a2dd223109?source=topic_page---------15------------------1,-
Medium.com,Life,What Does It Mean to be ‘Cali Sober’?,Cannabis,https://medium.com/the-cut/what-does-it-mean-to-be-cali-sober-834ccef55a19?source=topic_page---------16------------------1,-
Medium.com,Life,5 Terpenes Every Cannabis Consumer Should Know,Cannabis,https://medium.com/cannabis-explorations/5-terpenes-every-cannabis-consumer-should-know-8a184a11746f?source=topic_page---------17------------------1,-
Medium.com,Life,Medical Marijuana Smackdown: Grinspoon vs Berenson,Cannabis,https://medium.com/the-no-bs-guide-to-medical-cannabis/berenson-grinspoon-marijuana-debate-ef5968bbfe5?source=topic_page---------18------------------1,-
Medium.com,Life,What Happens When You Vape Marijuana Concentrates Every Day for Five Years?,Cannabis,https://medium.com/the-mindful-swamp-witch/what-happens-when-you-vape-marijuana-concentrates-every-day-for-five-years-b22ceec9fc8e?source=topic_page---------19------------------1,-
Medium.com,Life,"For Cannabis, Strain names don’t matter; Terpenes do.",Cannabis,https://medium.com/cannabis-explorations/for-cannabis-strain-names-dont-matter-terpenes-do-44976f6a3a4d?source=topic_page---------20------------------1,-
Medium.com,Life,5 Lessons from 5 Years in Cannabis,Cannabis,https://medium.com/@tutak/5-lessons-from-5-years-in-cannabis-436a5b17ba16?source=topic_page---------21------------------1,-
Medium.com,Life,"What to Know About Men, Marijuana, and Miscarriage",Cannabis,https://elemental.medium.com/what-to-know-about-men-marijuana-and-miscarriage-6c7f59dd321c?source=topic_page---------22------------------1,-
Medium.com,Life,"The Best Use of a Pot Breathalyzer Isn’t for Driving, It’s for Jobs",Cannabis,https://onezero.medium.com/the-best-use-of-a-pot-breathalyzer-isnt-for-driving-it-s-for-jobs-37d94a6effe5?source=topic_page---------23------------------1,-
Medium.com,Life,Why I love Dry Herb Vaping for Cannabis (and how to avoid some pitfalls!),Cannabis,https://medium.com/cannabis-explorations/why-i-love-dry-herb-vaping-for-cannabis-and-how-to-avoid-some-pitfalls-133a020d7753?source=topic_page---------24------------------1,-
Medium.com,Life,"Labs Give Legit Cannabis Clean Bill of Health, But CBD Is”Wild West”",Cannabis,https://medium.com/marijuana-wire/labs-give-legit-cannabis-clean-bill-of-health-but-cbd-is-wild-west-786a3981191f?source=topic_page---------25------------------1,-
Medium.com,Life,What Are The Benefits Of Legal Cannabis?,Cannabis,https://medium.com/@admin_12473/what-are-the-benefits-of-legal-cannabis-5aa994f9be1?source=topic_page---------26------------------1,-
Medium.com,Life,Judges Are Not Doctors: Why the ACLU Is Challenging a Ban on Medical Marijuana for People on…,Cannabis,https://medium.com/@ACLUPA/judges-are-not-doctors-why-the-aclu-is-challenging-a-ban-on-medical-marijuana-for-people-on-8703ae9feeb9?source=topic_page---------27------------------1,-
Medium.com,Life,"Eat, Drink, and Lather Yourself in CBD",Cannabis,https://thebolditalic.com/eat-drink-and-lather-yourself-in-cbd-70945652d5ec?source=topic_page---------28------------------1,-
Medium.com,Life,Does CBD Really Help With Obsessive-Compulsive Disorder?,Cannabis,https://medium.com/nordicoil/does-cbd-really-help-with-obsessive-compulsive-disorder-fbc7b29b6bf6?source=topic_page---------29------------------1,-
Medium.com,Life,Vape Ban In Massachusetts,Cannabis,https://medium.com/@marissafratoni/vape-ban-in-massachusetts-bdde2c8217f6?source=topic_page---------30------------------1,-
Medium.com,Life,Is The Weed Business About To Look Like the Coffee Business?,Cannabis,https://marker.medium.com/inside-the-race-to-build-the-starbucks-of-weed-6ebc5aa0eaf4?source=topic_page---------31------------------1,-
Medium.com,Life,De-Mystifying CBD,Cannabis,https://medium.com/thecbdfriend/de-mystifying-cbd-c43edd630ea1?source=topic_page---------32------------------1,-
Medium.com,Life,How Did Cyanide Get Into Bootleg Vape Carts?,Cannabis,https://medium.com/marijuana-wire/how-did-cyanide-get-into-bootleg-cannabis-vape-cartridges-71ec329622e7?source=topic_page---------33------------------1,-
Medium.com,Life,"Why alcohol-free, THC-infused beverages are the #futureofalcohol",Cannabis,https://medium.com/hngry/why-alcohol-free-thc-infused-beverages-are-the-futureofalcohol-e7004e6a69c3?source=topic_page---------34------------------1,-
Medium.com,Life,The Stoner’s Guide to Vaping Illness,Cannabis,https://medium.com/the-cut/the-stoners-guide-to-vaping-illness-c4e3e61da241?source=topic_page---------35------------------1,-
Medium.com,Life,Here’s Why China Is A Growing Hemp Superpower,Cannabis,https://medium.com/@ministryofhemp/heres-why-china-is-a-growing-hemp-superpower-4ae4b12ed7bc?source=topic_page---------36------------------1,-
Medium.com,Life,Medicinal Marijuana Is No Panacea,Cannabis,https://medium.com/swlh/medicinal-marijuana-is-no-panacea-a0c6e91e956e?source=topic_page---------37------------------1,-
Medium.com,Life,Oakland Dispensaries Are Struggling to Make Ends Meet,Cannabis,https://thebolditalic.com/oakland-dispensaries-are-struggling-to-make-ends-meet-f378b0e17f2d?source=topic_page---------38------------------1,-
Medium.com,Life,"Cannabis Is Your Plantcestor, Show Her Some Respect",Cannabis,https://humanparts.medium.com/cannabis-is-your-plantcestor-show-her-some-respect-6742b676012b?source=topic_page---------39------------------1,-
Medium.com,Life,Everything We Know About the Outbreak of Mysterious Vaping-Related Diseases,Cannabis,https://medium.com/popular-science/everything-we-know-about-the-outbreak-of-mysterious-vaping-related-diseases-3b82f0d8cf1?source=topic_page---------40------------------1,-
Medium.com,Life,Don’t Panic About E-Cigarettes,Cannabis,https://medium.com/@the_economist/dont-panic-about-e-cigarettes-e10a22151cb7?source=topic_page---------41------------------1,-
Medium.com,Life,"Medical Marijuana Rules, Regulations, & Legislature in Oklahoma (2019)",Cannabis,https://medium.com/greenscreens/medical-marijuana-rules-regulations-legislature-in-oklahoma-2019-c1dc1a3f3e2a?source=topic_page---------42------------------1,-
Medium.com,Life,DIY Psychedelics: Why grow and prepare your own plant medicine,Cannabis,https://medium.com/@jerrytoth/https-medium-com-jerrytoth-diy-psychedelics-109eae84ad5c?source=topic_page---------43------------------1,-
Medium.com,Life,Why Consistency Is The Key To Embracing CBD Products,Cannabis,https://medium.com/cbd-wellness/why-consistency-is-the-key-to-embracing-cbd-products-226e73516ed6?source=topic_page---------44------------------1,-
Medium.com,Life,CBD and Hot Flashes,Cannabis,https://medium.com/the-no-bs-guide-to-medical-cannabis/cbd-and-hot-flashes-29ffdabca1ec?source=topic_page---------45------------------1,-
Medium.com,Life,Japanese Law and Social Mores Still Treat Users of Soft Drugs Severely,Cannabis,https://medium.com/@the_economist/japanese-law-and-social-mores-still-treat-users-of-soft-drugs-severely-5af052987293?source=topic_page---------46------------------1,-
Medium.com,Life,The Downside of Marijuana That Nobody Talks About,Cannabis,https://medium.com/@j3216stone/the-downside-of-marijuana-that-nobody-talks-about-2c4aecdfbf39?source=topic_page---------47------------------1,-
Medium.com,Life,A Complete Introduction To Terpenes,Cannabis,https://medium.com/@ministryofhemp/a-complete-introduction-to-terpenes-81717a977019?source=topic_page---------48------------------1,-
Medium.com,Life,What are Retail Cannabis Regulations and Sales Tax in Illinois?,Cannabis,https://medium.com/greenscreens/what-are-retail-cannabis-regulations-and-sales-tax-in-illinois-621f575865c8?source=topic_page---------49------------------1,-
Medium.com,Life,What Happened When I Made Cannabis Suppositories,Cannabis,https://thebolditalic.com/what-happened-when-i-made-cannabis-suppositories-9fba199a926f?source=topic_page---------50------------------1,-
Medium.com,Life,Vape Safety Requires Legalizing Marijuana,Cannabis,https://medium.com/new-york-magazine/vape-safety-requires-legalizing-marijuana-16575d434ab0?source=topic_page---------51------------------1,-
Medium.com,Life,New Marijuana Breathalyzer is a Dud — But That Doesn’t Stop Cops from Using It,Cannabis,https://medium.com/@hdyerjr/new-marijuana-breathalyzer-turns-out-to-be-a-dud-but-doesnt-stop-cops-from-using-it-16b5819f4393?source=topic_page---------52------------------1,-
Medium.com,Life,Vaping Injuries Left a Trail of Dire Cases Around the U.S.,Cannabis,https://medium.com/bloomberg/vaping-injuries-left-a-trail-of-dire-cases-around-the-u-s-72814f968a9f?source=topic_page---------53------------------1,-
Medium.com,Life,The Devil’s Candy,Cannabis,https://gay.medium.com/the-devils-candy-6474338d54ee?source=topic_page---------54------------------1,-
Medium.com,Life,How CBD Saved My Life And Helped Me Graduate College,Cannabis,https://medium.com/@kaytchristensen/how-cbd-saved-my-life-and-helped-me-graduate-college-c0b06af03f5f?source=topic_page---------55------------------1,-
Medium.com,Life,"Crisis Looms For Cannabis Industry As Bootleg Vape Toll Passes 1,000",Cannabis,https://medium.com/marijuana-wire/dispensary-oil-implicated-in-second-cannabis-vaping-death-a4d974add92?source=topic_page---------56------------------1,-
Medium.com,Life,The Ultimate Guide to Marketing Your Dispensary,Cannabis,https://medium.com/greenscreens/the-ultimate-guide-to-marketing-your-dispensary-d45494c4dbd5?source=topic_page---------57------------------1,-
Medium.com,Life,A Global Revolution in Attitudes Towards Cannabis Is Under Way,Cannabis,https://medium.com/@the_economist/a-global-revolution-in-attitudes-towards-cannabis-is-under-way-1119f56d82cf?source=topic_page---------58------------------1,-
Medium.com,Life,I Use Medical Marijuana To Treat My PTSD,Cannabis,https://medium.com/@megwardwrites/i-use-medical-marijuana-to-treat-my-ptsd-1effdf5915d6?source=topic_page---------59------------------1,-
Medium.com,Life,Quitting Cannabis: How I Lost Control and Found Choice,Cannabis,https://medium.com/@rachellewett/quitting-cannabis-how-i-lost-control-and-found-choice-974f0362ab83?source=topic_page---------60------------------1,-
Medium.com,Life,What Makes It “Medical Marijuana”?,Cannabis,https://medium.com/the-no-bs-guide-to-medical-cannabis/medical-marijuana-versus-recreational-marijuana-c55f7cef191?source=topic_page---------61------------------1,-
Medium.com,Life,The Untapped Potential of Medical CBD,Cannabis,https://elemental.medium.com/the-untapped-potential-of-medical-cbd-6676f94ee7c5?source=topic_page---------62------------------1,-
Medium.com,Life,By Stanley von Ehrenstein-Smith,Cannabis,https://medium.com/@stanleyves/by-stanley-von-ehrenstein-smith-820614722fe9?source=topic_page---------63------------------1,-
Medium.com,Life,Vegan CBD Products That Are Actually Worth It,Cannabis,https://medium.com/tenderlymag/27-vegan-cbd-products-that-are-actually-worth-it-548642aedbfa?source=topic_page---------64------------------1,-
Medium.com,Life,Should You Avoid Cannabis While Breastfeeding?,Cannabis,https://medium.com/@kimberlyvlawson/should-you-avoid-cannabis-while-breastfeeding-5ca734ccdde2?source=topic_page---------65------------------1,-
Medium.com,Life,Ads Pitching CBD as a Cure-All Are Everywhere. Oversight Hasn’t Kept Up.,Cannabis,https://medium.com/the-new-york-times/ads-pitching-cbd-as-a-cure-all-are-everywhere-oversight-hasnt-kept-up-a0f978a634bb?source=topic_page---------66------------------1,-
Medium.com,Life,Exaggerated Health Claims Prompt FDA to Hold First Hearing on CBD,Cannabis,https://medium.com/swlh/exaggerated-health-claims-prompt-fda-to-hold-first-hearing-on-cbd-c49a0207ebe8?source=topic_page---------67------------------1,-
Medium.com,Life,The Real Star of Outside Lands 2019: Grass Lands,Cannabis,https://thebolditalic.com/the-real-star-of-outside-lands-2019-grass-lands-ddb2e7eab7c0?source=topic_page---------68------------------1,-
Medium.com,Life,"Tripped Out: On Getting High, and Why Psychedelics Intrigue Me",Cannabis,https://medium.com/@lizziewoo/tripped-out-on-getting-high-and-why-psychedelics-intrigue-me-3cd982aa1a3d?source=topic_page---------69------------------1,-
Medium.com,Life,Marijuana Could Soon Be Decriminalized in Georgia,Cannabis,https://medium.com/@samuelj31415/marijuana-could-soon-be-decriminalized-in-georgia-fce701e3544a?source=topic_page---------70------------------1,-
Medium.com,Life,Two Routes to Federal Cannabis Legalization,Cannabis,https://medium.com/@jennifergumer/two-routes-to-federal-cannabis-legalization-2be6a67bde26?source=topic_page---------71------------------1,-
Medium.com,Life,Marijuana During Pregnancy Might Be as Dangerous as Alcohol,Cannabis,https://medium.com/popular-science/marijuana-during-pregnancy-might-be-as-dangerous-as-alcohol-a844c1d5badd?source=topic_page---------72------------------1,-
Medium.com,Life,Is Your Weed Vegan?,Cannabis,https://medium.com/tenderlymag/is-your-weed-vegan-8ff77e30c075?source=topic_page---------73------------------1,-
Medium.com,Life,We Don’t Have a ‘Drug Problem’,Cannabis,https://medium.com/@mayayonika/we-dont-have-a-drug-problem-bb3d5e5c292c?source=topic_page---------74------------------1,-
Medium.com,Life,3 Obstacles Halting U.S. Cannabis Industry Momentum,Cannabis,https://medium.com/the-mission/3-obstacles-halting-u-s-cannabis-industry-momentum-2d96dc99ea45?source=topic_page---------75------------------1,-
Medium.com,Life,Compound in Marijuana May Help Treat Schizophrenia,Cannabis,https://medium.com/invisible-illness/compound-in-marijuana-may-help-treat-schizophrenia-177840b7a723?source=topic_page---------76------------------1,-
Medium.com,Life,Building Social Responsibility Into a New Cannabis Business,Cannabis,https://medium.com/supermaker-com/building-social-responsibility-into-a-new-cannabis-business-f4a2449cb024?source=topic_page---------77------------------1,-
Medium.com,Life,Proper Disposal of Cannabis — The Basics for Individuals and Businesses,Cannabis,https://medium.com/tcheck/proper-disposal-of-cannabis-the-basics-for-individuals-and-businesses-2c9686e07e39?source=topic_page---------78------------------1,-
Medium.com,Life,Reports Suggest Legal Marijuana Increases Illegal Possession Arrests,Cannabis,https://medium.com/@subverse/reports-suggest-legal-marijuana-increases-illegal-possession-arrests-4703c924eb44?source=topic_page---------79------------------1,-
Medium.com,Life,Texans Most Affected by Marijuana Policy Appear Less Likely to be Civically Active,Cannabis,https://medium.com/@LyleChad/texans-most-affected-by-marijuana-policy-appear-less-likely-to-be-civically-active-36541407391f?source=topic_page---------80------------------1,-
Medium.com,Life,More Than Medicine: Other Benefits of Legalizing Cannabis,Cannabis,https://medium.com/@angelaschweers/more-than-medicine-other-benefits-of-legalizing-cannabis-8ae4b47089ca?source=topic_page---------81------------------1,-
Medium.com,Life,CBD — Snake Oil or the Next Big Thing?,Cannabis,https://medium.com/@karimcmahon/cbd-snake-oil-or-the-next-big-thing-f575ac9d1ee?source=topic_page---------82------------------1,-
Medium.com,Life,Looking to Make More Green as a Freelancer?,Cannabis,https://medium.com/escape-motivation/looking-to-make-more-green-as-a-freelancer-ba10245c02a8?source=topic_page---------83------------------1,-
Medium.com,Life,Researchers Find Pain Relief Potential of Cannabis,Cannabis,https://medium.com/@subverse/researchers-find-pain-relief-potential-of-cannabis-580c02d12e99?source=topic_page---------84------------------1,-
Medium.com,Life,Medical Marijuana and Seniors,Cannabis,https://medium.com/the-no-bs-guide-to-medical-cannabis/medical-marijuana-and-seniors-ba791c2dd582?source=topic_page---------85------------------1,-
Medium.com,Life,How the Endocannabinoid System Interacts And Affects Our Hormones?,Cannabis,https://medium.com/quality-cbd/how-the-endocannabinoid-system-interacts-and-affects-our-hormones-ae992ae39df7?source=topic_page---------86------------------1,-
Medium.com,Life,Cannabis Stocks Are Crashing: 3 Pot Stocks on Sale,Cannabis,https://medium.com/the-motley-fool/cannabis-stocks-are-crashing-3-pot-stocks-on-sale-ed720e6da37d?source=topic_page---------87------------------1,-
Medium.com,Life,How CBD-Infused Products Are Improving My Quality of Life,Cannabis,https://medium.com/cbd-wellness/how-cbd-infused-products-are-improving-my-quality-of-life-a636534cc839?source=topic_page---------88------------------1,-
Medium.com,Life,Can You Work Better While High?,Cannabis,https://elemental.medium.com/can-you-work-better-while-high-85ea26e9a46?source=topic_page---------89------------------1,-
Medium.com,Life,Illinois Becomes The 11th US State To Legalize Weed,Cannabis,https://medium.com/@yomiadebisi/illinois-becomes-the-11th-us-state-to-legalize-weed-800834b52e40?source=topic_page---------90------------------1,-
Medium.com,Life,How Not to Argue in Favor of Cannabis,Cannabis,https://medium.com/the-no-bs-guide-to-medical-cannabis/how-not-to-argue-in-favor-of-cannabis-27a020845b08?source=topic_page---------91------------------1,-
Medium.com,Life,Cannabis Transformed My Sex Life,Cannabis,https://medium.com/soccer-domme/cannabis-transformed-my-sex-life-3acf6f78ada5?source=topic_page---------92------------------1,-
Medium.com,Life,"Yes, There Is Too Such A Thing As A Marijuana Expert",Cannabis,https://medium.com/the-no-bs-guide-to-medical-cannabis/yes-there-is-too-such-a-thing-as-a-marijuana-expert-d51cf18b16c1?source=topic_page---------93------------------1,-
Medium.com,Life,What Does Science Say About Using CBD For ADHD?,Cannabis,https://medium.com/@ministryofhemp/what-does-science-say-about-using-cbd-for-adhd-e1e59b9d8725?source=topic_page---------94------------------1,-
Medium.com,Life,New Illinois Law Legalizing Marijuana in 2020: Frequently Asked Questions,Cannabis,https://medium.com/@OflahertyLaw/new-illinois-law-legalizing-marijuana-in-2020-frequently-asked-questions-2fee85ae3dad?source=topic_page---------95------------------1,-
Medium.com,Life,Indica or Sativa Marijuana—Explained,Cannabis,https://medium.com/cannabis-education/indica-or-sativa-marijuana-explained-25176ad7a865?source=topic_page---------96------------------1,-
Medium.com,Life,Girls Just Wanna Get Stoned,Cannabis,https://medium.com/@mibowden505/girls-just-wanna-get-stoned-e055800cefcd?source=topic_page---------97------------------1,-
Medium.com,Life,CBD and the Age of Recovery,Cannabis,https://medium.com/forbes/cbd-and-the-age-of-recovery-7c9dd8ed659a?source=topic_page---------98------------------1,-
Medium.com,Life,Is Marijuana Addictive?,Cannabis,https://elemental.medium.com/is-marijuana-addictive-ab3a99b4276e?source=topic_page---------99------------------1,-
Medium.com,Life,What It’s Like to Exercise While You’re Stoned,Cannabis,https://medium.com/@ascension_/what-its-like-to-exercise-while-you-re-stoned-3e7ebc9c1d03?source=topic_page---------100------------------1,-
Medium.com,Life,THC Overdose: What’s Going On In Louisiana?,Cannabis,https://medium.com/the-no-bs-guide-to-medical-cannabis/the-strange-case-of-thc-overdose-in-louisiana-48eebe667de8?source=topic_page---------101------------------1,-
Medium.com,Life,Marijuana and Opioid Deaths: Is There A Connection?,Cannabis,https://medium.com/the-no-bs-guide-to-medical-cannabis/cannabis-use-and-opioid-deaths-is-there-a-connection-2cee12d5943f?source=topic_page---------102------------------1,-
Medium.com,Life,"This Week in CBD: July 5, 2019",Cannabis,https://medium.com/cbd-hacker/this-week-in-cbd-july-5-2019-ce6e171c504d?source=topic_page---------103------------------1,-
Medium.com,Life,Cannabis and Driving,Cannabis,https://medium.com/quality-cbd/cannabis-and-driving-e8e2ced4648b?source=topic_page---------104------------------1,-
Medium.com,Life,From Rice Krispy Treats to Road Trips,Cannabis,https://medium.com/nexus-generation/from-rice-krispy-treats-to-road-trips-1092ca542d06?source=topic_page---------105------------------1,-
Medium.com,Life,What Coca Tea Can Teach Us About CBD,Cannabis,https://medium.com/@ar1522/what-coca-tea-can-teach-us-about-cbd-9bac59616d90?source=topic_page---------106------------------1,-
Medium.com,Life,Is CBG the New CBD?,Cannabis,https://elemental.medium.com/is-cbg-the-new-cbd-6de59e568008?source=topic_page---------107------------------1,-
Medium.com,Life,Parenting on Pot,Cannabis,https://elemental.medium.com/parenting-on-pot-8719b38640be?source=topic_page---------108------------------1,-
Medium.com,Life,Women and Weed: Why Marijuana Legalization is a Feminist Cause,Cannabis,https://medium.com/@emilyrosethorne6/women-and-weed-why-marijuana-legalization-is-a-feminist-cause-91e96e7aab5?source=topic_page---------109------------------1,-
Medium.com,Life,Marijuana Has Highlighted My Misuse of Her: Here is My Sincere Answer to the Point She’s Raised,Cannabis,https://medium.com/@alyssthehuman/marijuana-has-highlighted-my-misuse-of-her-here-is-my-sincere-answer-to-the-point-shes-raised-d3eb367e9b39?source=topic_page---------110------------------1,-
Medium.com,Life,The FDA Is About to Crack Down on Shady CBD Products,Cannabis,https://elemental.medium.com/the-fda-is-about-to-crack-down-on-shady-cbd-products-765b7f76a882?source=topic_page---------111------------------1,-
Medium.com,Life,How CBD is Improving my Mental Health and My Life,Cannabis,https://medium.com/@emilystroia/how-cbd-is-improving-my-mental-health-and-my-life-3433e4333ffe?source=topic_page---------112------------------1,-
Medium.com,Life,Marijuana Breeding Explained,Cannabis,https://medium.com/cannabis-education/marijuana-breeding-explained-59c6f8713f4?source=topic_page---------113------------------1,-
Medium.com,Life,How Cannabis Keeps My Bipolar Condition in Check,Cannabis,https://zora.medium.com/how-cannabis-keeps-my-bipolar-condition-in-check-f72932166d88?source=topic_page---------114------------------1,-
Medium.com,Life,Agritech: A Cleaner Future?,Cannabis,https://medium.com/canzeo/agritech-a-cleaner-future-3f9b214f49a?source=topic_page---------115------------------1,-
Medium.com,Life,How Cannabis Saved My Fiance’s Life,Cannabis,https://medium.com/@gpetticrew/how-cannabis-saved-my-fiances-life-c4c29a2007b0?source=topic_page---------116------------------1,-
Medium.com,Life,Five lessons from Harborside going public,Cannabis,https://medium.com/@phillipscheather/five-lessons-from-harborside-going-public-585cb950736f?source=topic_page---------117------------------1,-
