Source,Domain,Heading,Category,URL,Text
Medium.com,Innovation & Tech,Lithium-ion Batteries Remade the World — They Need to Change,Digital Life,https://onezero.medium.com/lithium-ion-batteries-remade-the-world-they-need-to-change-a0a82419a0cb?source=topic_page---------0------------------1,-
Medium.com,Innovation & Tech,Why You’ll Still Use Instagram After It Removes the ‘Likes’,Digital Life,https://thebolditalic.com/why-youll-still-use-instagram-after-it-removes-the-likes-f4e0282014c1?source=topic_page---------1------------------1,-
Medium.com,Innovation & Tech,How to Make a Website,Digital Life,https://medium.com/the-atlantic/how-to-make-a-website-4292cfe885a5?source=topic_page---------2------------------1,-
Medium.com,Innovation & Tech,The Five Stages of Dating on Bumble While Over 40,Digital Life,https://medium.com/swlh/the-five-stages-of-dating-on-bumble-while-over-40-8034cac563db?source=topic_page---------4------------------1,-
Medium.com,Innovation & Tech,Is Tech to Blame for our Loneliness?,Digital Life,https://medium.com/swlh/is-tech-to-blame-for-our-loneliness-f285d7fb69cb?source=topic_page---------5------------------1,-
Medium.com,Innovation & Tech,You’ve got dopamine,Digital Life,https://medium.com/@riannanrayne/youve-got-dopamine-ea15037999f9?source=topic_page---------6------------------1,-
Medium.com,Innovation & Tech,Bullet Time,Digital Life,https://medium.com/logic-magazine/bullet-time-f39caf2305da?source=topic_page---------7------------------1,-
Medium.com,Innovation & Tech,Inside KSI and Logan Paul’s Fight for Acceptance from Mainstream Boxing,Digital Life,https://ffwd.medium.com/inside-ksi-and-logan-pauls-fight-for-acceptance-from-mainstream-boxing-9ba0f43ea022?source=topic_page---------8------------------1,-
Medium.com,Innovation & Tech,The Joy of Avoiding Instagram,Digital Life,https://onezero.medium.com/the-joy-of-avoiding-instagram-f73f4dff2a?source=topic_page---------9------------------1,-
Medium.com,Innovation & Tech,Apple Is Trying to Kill Web Technology,Digital Life,https://onezero.medium.com/apple-is-trying-to-kill-web-technology-a274237c174d?source=topic_page---------10------------------1,-
Medium.com,Innovation & Tech,Is Struggle To Win The Popularity Race Reshaping Our Minds?,Digital Life,https://medium.com/the-partnered-pen/is-struggle-to-win-the-popularity-race-reshaping-our-minds-fae14b98709?source=topic_page---------11------------------1,-
Medium.com,Innovation & Tech,What Happens When You Tweet a Death Threat to the President?,Digital Life,https://onezero.medium.com/what-happens-when-you-tweet-a-death-threat-to-the-president-ca2ed3e4b317?source=topic_page---------12------------------1,-
Medium.com,Innovation & Tech,3 Harms of Secondhand Social Media and Smartphone Use,Digital Life,https://medium.com/soli-deo-gloria/3-harms-of-secondhand-social-media-and-smartphone-use-b0e93f9eef87?source=topic_page---------13------------------1,-
Medium.com,Innovation & Tech,The Apps That Can Make Your Breakup Less Terrible,Digital Life,https://forge.medium.com/the-apps-that-can-make-your-breakup-less-terrible-234da5b2929f?source=topic_page---------14------------------1,-
Medium.com,Innovation & Tech,Everyone in Tech Should Read Speculative Fiction,Digital Life,https://onezero.medium.com/why-everybody-in-tech-should-read-speculative-fiction-1e045110610e?source=topic_page---------15------------------1,-
Medium.com,Innovation & Tech,Men Won’t Let Go of Their Phones While Peeing,Digital Life,https://onezero.medium.com/men-wont-let-go-of-their-phones-while-peeing-ba928a5397b5?source=topic_page---------16------------------1,-
Medium.com,Innovation & Tech,The Age of the Superplatform,Digital Life,https://medium.com/swlh/the-age-of-the-superplatform-18546fa77680?source=topic_page---------17------------------1,-
Medium.com,Innovation & Tech,‘Fake News’ Can’t Be Flagged Down,Digital Life,https://medium.com/texas-mccombs/fake-news-can-t-be-flagged-down-4561d9438703?source=topic_page---------18------------------1,-
Medium.com,Innovation & Tech,TikTok & The Evolution of Meme Culture,Digital Life,https://medium.com/@mackgrenfell/tiktok-the-evolution-of-meme-culture-5e9242162494?source=topic_page---------19------------------1,-
Medium.com,Innovation & Tech,Immortality at last! Now there’s a solution to link rot,Digital Life,https://medium.com/enrique-dans/immortality-at-last-now-theres-a-solution-to-link-rot-cdc90ccce685?source=topic_page---------20------------------1,-
Medium.com,Innovation & Tech,Native American Reservations Still Struggle to Get Basic Internet Connections,Digital Life,https://onezero.medium.com/native-american-reservations-still-struggle-to-get-basic-internet-connections-ce6ba5445ccb?source=topic_page---------21------------------1,-
Medium.com,Innovation & Tech,I Stopped Checking my Phone First Thing in the Morning. This is What Happened.,Digital Life,https://medium.com/simply-live/i-stopped-checking-my-phone-first-thing-in-the-morning-this-is-what-happened-5fbcad002be0?source=topic_page---------22------------------1,-
Medium.com,Innovation & Tech,Politicians dodging questions: How much do British politicians equivocate in online Q&As?,Digital Life,https://medium.com/swlh/politicians-dodging-questions-how-much-do-british-politicians-equivocate-in-online-q-as-358fd981bca1?source=topic_page---------23------------------1,-
Medium.com,Innovation & Tech,What type of questions do people ask British politicians in online Q&As?,Digital Life,https://medium.com/swlh/what-type-of-questions-do-people-ask-british-politicians-in-online-q-as-e8aaa2f6315f?source=topic_page---------24------------------1,-
Medium.com,Innovation & Tech,ClassPass Has a Spam Problem,Digital Life,https://onezero.medium.com/classpass-has-a-spam-problem-d921daae8922?source=topic_page---------25------------------1,-
Medium.com,Innovation & Tech,YouTube’s P-Score Says More About the Platform than its Users,Digital Life,https://medium.com/swlh/youtubes-p-score-says-more-about-the-platform-than-its-users-18152d5b3b71?source=topic_page---------26------------------1,-
Medium.com,Innovation & Tech,My Wallet Was Stolen: A Case for Digitizing EVERYTHING,Digital Life,https://medium.com/swlh/my-wallet-was-stolen-a-case-for-digitizing-everything-536bb0230bb0?source=topic_page---------27------------------1,-
Medium.com,Innovation & Tech,What I learned From 24 hours Without Screen Time,Digital Life,https://medium.com/live-your-life-on-purpose/what-i-learned-from-24-hours-without-screen-time-fcb394eb0720?source=topic_page---------28------------------1,-
Medium.com,Innovation & Tech,"Inside Discord’s Unmoderated, Potentially Dangerous Teen Dating Network",Digital Life,https://onezero.medium.com/despite-strict-ban-discord-is-a-hub-for-potentially-dangerous-underage-dating-6749383f5e90?source=topic_page---------29------------------1,-
Medium.com,Innovation & Tech,"Reddit’s Automoderator Is the Future of the Internet, and Deeply Imperfect",Digital Life,https://medium.com/mit-technology-review/reddits-automoderator-is-the-future-of-the-internet-and-deeply-imperfect-f2279f2c9a61?source=topic_page---------30------------------1,-
Medium.com,Innovation & Tech,How Instagram Spoils Your Relationship With Food,Digital Life,https://onezero.medium.com/how-instagram-spoils-your-relationship-with-food-39cf0b5b8a9e?source=topic_page---------31------------------1,-
Medium.com,Innovation & Tech,It’s Good to Zone Out,Digital Life,https://medium.com/swlh/its-good-to-zone-out-41e15be32678?source=topic_page---------32------------------1,-
Medium.com,Innovation & Tech,The Age of Addiction. Why?,Digital Life,https://medium.com/swlh/the-age-of-addiction-why-18794a51087d?source=topic_page---------33------------------1,-
Medium.com,Innovation & Tech,Confessions of a Twitter Outrage Addict,Digital Life,https://medium.com/swlh/confessions-of-a-twitter-outrage-addict-4df377a39b90?source=topic_page---------34------------------1,-
Medium.com,Innovation & Tech,"In Big Data, The Consumer Is The Product",Digital Life,https://medium.com/swlh/in-big-data-the-consumer-is-the-product-ad9bf0423d9a?source=topic_page---------35------------------1,-
Medium.com,Innovation & Tech,Viral Positivity: Marketing Lessons From Mr. Beast’s Meteoric Rise to Fame,Digital Life,https://medium.com/better-marketing/viral-positivity-marketing-lessons-from-mr-beasts-meteoric-rise-to-fame-970936cacdce?source=topic_page---------36------------------1,-
Medium.com,Innovation & Tech,OnMyWay Promises ‘Cash’ for Driving Safe — But There’s a Catch,Digital Life,https://onezero.medium.com/onmyway-promises-cash-for-driving-safe-but-there-s-a-big-catch-345686cbef00?source=topic_page---------37------------------1,-
Medium.com,Innovation & Tech,AirPods Pro Review: They’re Great (and Expensive),Digital Life,https://onezero.medium.com/airpods-pro-review-theyre-great-and-too-expensive-cd809193f14f?source=topic_page---------38------------------1,-
Medium.com,Innovation & Tech,Russia Is About to Disconnect From the Internet: Here’s What That Means,Digital Life,https://medium.com/pcmag-access/russia-is-about-to-disconnect-from-the-internet-heres-what-that-means-7e05318753a7?source=topic_page---------39------------------1,-
Medium.com,Innovation & Tech,"A Ban on Political Ads: Who’s right, Jack Dorsey or Mark Zuckerberg?",Digital Life,https://medium.com/swlh/a-ban-on-political-ads-whos-right-jack-dorsey-or-mark-zuckerberg-a0eefb69d970?source=topic_page---------40------------------1,-
Medium.com,Innovation & Tech,The Weirdest Shit to Come Out of Silicon Valley in October,Digital Life,https://thebolditalic.com/the-weirdest-shit-to-come-out-of-silicon-valley-in-october-372b92573db4?source=topic_page---------41------------------1,-
Medium.com,Innovation & Tech,Netflix’s New Playback Speed Feature Is Getting Backlash From Creators,Digital Life,https://onezero.medium.com/netflixs-new-playback-speed-feature-is-getting-backlash-from-creators-635dfcf4aaaa?source=topic_page---------42------------------1,-
Medium.com,Innovation & Tech,Too Fat for Uber,Digital Life,https://medium.com/@Shesreallyfat/too-fat-for-uber-2a16714e279f?source=topic_page---------43------------------1,-
Medium.com,Innovation & Tech,Apple’s Gender-Neutral Emojis Aren’t for Everyone,Digital Life,https://onezero.medium.com/apples-gender-neutral-emojis-aren-t-for-everyone-17c6269c5a95?source=topic_page---------44------------------1,-
Medium.com,Innovation & Tech,Looking At Cute Animals Online Is Literally Good for Your Brain,Digital Life,https://onezero.medium.com/looking-at-cute-animals-online-is-literally-good-for-your-brain-2eaa291d8568?source=topic_page---------45------------------1,-
Medium.com,Innovation & Tech,Virtual Machines in an Actual World,Digital Life,https://medium.com/computers-and-culture/virtual-machines-in-an-actual-world-34adfa99c894?source=topic_page---------46------------------1,-
Medium.com,Innovation & Tech,Building A Community,Digital Life,https://medium.com/@lixiaoan/building-a-community-5705888af7b7?source=topic_page---------47------------------1,-
Medium.com,Innovation & Tech,Halloween Costume Ideas for People Who Live Extremely Online,Digital Life,https://gen.medium.com/digital-halloween-costumes-968299ec303c?source=topic_page---------48------------------1,-
Medium.com,Innovation & Tech,What are the Repercussions of Clickbait on Society?,Digital Life,https://medium.com/discourse/what-are-the-repercussions-of-clickbait-on-society-a5c56ec6599a?source=topic_page---------49------------------1,-
Medium.com,Innovation & Tech,Giving Up Social Media For 30 Days,Digital Life,https://medium.com/swlh/giving-up-social-media-for-30-days-1f14ed7fdd9a?source=topic_page---------50------------------1,-
Medium.com,Innovation & Tech,An Internet Clampdown Is Coming to Russia,Digital Life,https://onezero.medium.com/an-internet-clampdown-is-coming-to-russia-d77ff8d72f5d?source=topic_page---------51------------------1,-
Medium.com,Innovation & Tech,Tech Shouldn’t Look Like Tech,Digital Life,https://onezero.medium.com/tech-shouldnt-look-like-tech-fdc58455b703?source=topic_page---------52------------------1,-
Medium.com,Innovation & Tech,Don’t Trust the Internet. Ever.,Digital Life,https://medium.com/swlh/dont-trust-the-internet-ever-8ef49fb5c19e?source=topic_page---------53------------------1,-
Medium.com,Innovation & Tech,5 Key Things to Know About the New AirPods Pro,Digital Life,https://onezero.medium.com/5-key-things-to-know-about-the-airpods-pro-32da5a0dcdc6?source=topic_page---------54------------------1,-
Medium.com,Innovation & Tech,How to Make Friends on Dating Apps,Digital Life,https://psiloveyou.xyz/how-to-make-friends-on-dating-apps-97118ee46d93?source=topic_page---------55------------------1,-
Medium.com,Innovation & Tech,Teach Yourself How to Communicate in a Digital World,Digital Life,https://medium.com/swlh/teach-yourself-how-to-communicate-in-a-digital-world-bd5f6b2643b4?source=topic_page---------56------------------1,-
Medium.com,Innovation & Tech,The Internet Was My Eating Disorder’s Frenemy,Digital Life,https://medium.com/swlh/the-internet-was-my-eating-disorders-frenemy-4637fd8e7c4b?source=topic_page---------57------------------1,-
Medium.com,Innovation & Tech,Time Spent Looking At My Phone,Digital Life,https://medium.com/swlh/time-spent-looking-at-my-phone-f50b9f27c62d?source=topic_page---------58------------------1,-
Medium.com,Innovation & Tech,Amazon’s A.I. Emotion-Recognition Software Confuses Expressions for Feelings,Digital Life,https://onezero.medium.com/amazons-a-i-emotion-recognition-software-confuses-expressions-for-feelings-53e96007ca63?source=topic_page---------59------------------1,-
Medium.com,Innovation & Tech,Do Algorithms Know Your Body Better Than You?,Digital Life,https://onezero.medium.com/do-algorithms-know-your-body-better-than-you-2f1c7d241144?source=topic_page---------60------------------1,-
Medium.com,Innovation & Tech,How Memes Got Weaponized: A Short History,Digital Life,https://medium.com/mit-technology-review/how-memes-got-weaponized-a-short-history-e2276845f334?source=topic_page---------61------------------1,-
Medium.com,Innovation & Tech,How TV Became Tech’s Favorite Vanity Project,Digital Life,https://onezero.medium.com/how-tv-became-techs-favorite-vanity-project-1ec15105dcc0?source=topic_page---------62------------------1,-
Medium.com,Innovation & Tech,Getting Cash for Our Data Could Actually Make Things Worse,Digital Life,https://onezero.medium.com/getting-cash-for-our-data-could-actually-make-things-worse-3793c52ec7e5?source=topic_page---------63------------------1,-
Medium.com,Innovation & Tech,How Streaming Saved the Romantic Comedy,Digital Life,https://gen.medium.com/how-streaming-saved-the-romantic-comedy-356722b06475?source=topic_page---------64------------------1,-
Medium.com,Innovation & Tech,"Teaching Kids About Healthy, Responsible & Impactful Uses of Social Media",Digital Life,https://medium.com/swlh/teaching-kids-about-healthy-responsible-impactful-uses-of-social-media-1ba10c744fcf?source=topic_page---------65------------------1,-
Medium.com,Innovation & Tech,Are You Seeing Way More Ads on Twitter? Here’s Why.,Digital Life,https://onezero.medium.com/are-you-seeing-way-more-ads-on-twitter-heres-why-d7f4a6681fe3?source=topic_page---------66------------------1,-
Medium.com,Innovation & Tech,Extreme Fasting is Sweeping Through Silicon Valley,Digital Life,https://thebolditalic.com/the-fine-line-between-fasting-and-an-eating-disorder-29b05538bb47?source=topic_page---------67------------------1,-
Medium.com,Innovation & Tech,Five More Minutes on Instagram!,Digital Life,https://onezero.medium.com/translate-your-well-honed-parenting-skills-to-your-childs-digital-world-c22378129dc5?source=topic_page---------68------------------1,-
Medium.com,Innovation & Tech,Cyberspace and dating is The Purge of our generation,Digital Life,https://medium.com/@DiaryOfaWannaB/cyberspace-and-dating-is-the-purge-of-our-generation-a137f5c6cd9d?source=topic_page---------69------------------1,-
Medium.com,Innovation & Tech,Leftist Infighting Is Eating BreadTube Inside Out,Digital Life,https://medium.com/swlh/contrapoints-philosophy-tube-hbomberguy-infighting-controversy-breadtube-dbaa3148b4dd?source=topic_page---------70------------------1,-
Medium.com,Innovation & Tech,The Gamergate-Like Veneer of Anti-BreadTube Backlash,Digital Life,https://medium.com/swlh/breadtube-contrapoints-hbomberguy-philosophy-tube-lindsay-ellis-controversy-gamergate-658f6b7d290b?source=topic_page---------71------------------1,-
Medium.com,Innovation & Tech,Has the Ability to See Beyond the Opinions to the People Disappeared?,Digital Life,https://medium.com/swlh/has-the-ability-to-see-beyond-the-opinions-to-the-people-disappeared-194bb9a81d87?source=topic_page---------72------------------1,-
Medium.com,Innovation & Tech,What it’s like being harassed online to advance a politician’s career,Digital Life,https://medium.com/swlh/what-its-like-being-harassed-online-to-advance-a-politician-s-career-842d43762c95?source=topic_page---------73------------------1,-
Medium.com,Innovation & Tech,The Human Cost of Your Smartphone,Digital Life,https://onezero.medium.com/the-human-cost-of-your-smartphone-d583a2b6f356?source=topic_page---------74------------------1,-
Medium.com,Innovation & Tech,Facial analysis AI is being used in job interviews — and that’s the problem,Digital Life,https://mlk50.com/facial-analysis-ai-is-being-used-in-job-interviews-and-thats-the-problem-d892216b912b?source=topic_page---------75------------------1,-
Medium.com,Innovation & Tech,The Complete Guide to Optimizing Your LinkedIn Profile,Digital Life,https://medium.com/better-marketing/the-complete-guide-to-optimizing-your-linkedin-profile-6d9f8d07b9d6?source=topic_page---------76------------------1,-
Medium.com,Innovation & Tech,"The Foolproof Guide to More Views, Subscribers, and Money on YouTube",Digital Life,https://medium.com/better-marketing/the-foolproof-guide-to-more-views-subscribers-and-money-on-youtube-4c61bd64bfbf?source=topic_page---------77------------------1,-
Medium.com,Innovation & Tech,“s*x workers’ safety…and well-being is at risk when we’re shadowbanned & removed from social media?,Digital Life,https://medium.com/swlh/s-x-workers-safety-and-well-being-is-at-risk-when-we-re-shadowbanned-removed-from-social-media-3c880c526f85?source=topic_page---------78------------------1,-
Medium.com,Innovation & Tech,How COLORS Became the Music Industry’s Tastemaker,Digital Life,https://ffwd.medium.com/how-colors-became-the-music-industrys-tastemaker-db50dd143bc8?source=topic_page---------79------------------1,-
Medium.com,Innovation & Tech,Texting Before There Was Texting,Digital Life,https://modus.medium.com/texting-before-there-was-texting-3db65366aebf?source=topic_page---------80------------------1,-
Medium.com,Innovation & Tech,Memoji Are Apple’s Greatest Invention Since the iPhone,Digital Life,https://onezero.medium.com/memoji-are-apples-greatest-invention-since-the-iphone-3ab8feb2575b?source=topic_page---------81------------------1,-
Medium.com,Innovation & Tech,Digital sobriety 101,Digital Life,https://medium.com/swlh/digital-sobriety-101-6c33cf79ac79?source=topic_page---------82------------------1,-
Medium.com,Innovation & Tech,Digital Detoxing: Surviving 28 Days Without Digital Dopamine,Digital Life,https://medium.com/@elainemead/digital-detoxing-surviving-28-days-without-digital-dopamine-d8618db049f3?source=topic_page---------83------------------1,-
Medium.com,Innovation & Tech,Mitt Romney’s Secret Twitter Account Shows Everyone Has a Finsta,Digital Life,https://onezero.medium.com/mitt-romneys-secret-twitter-account-shows-everyone-has-a-finsta-e7feb3781a15?source=topic_page---------84------------------1,-
Medium.com,Innovation & Tech,Are Fantasy Sports Really Gambling?,Digital Life,https://medium.com/nautilus-magazine/are-fantasy-sports-really-gambling-33d7f3a3396?source=topic_page---------85------------------1,-
Medium.com,Innovation & Tech,Slack and the Decline of Bots,Digital Life,https://onezero.medium.com/slack-and-the-decline-of-bots-34119c6698b4?source=topic_page---------86------------------1,-
Medium.com,Innovation & Tech,Read This Before You Whistleblow With an App,Digital Life,https://onezero.medium.com/read-this-before-you-whistleblow-with-an-app-f193114e7596?source=topic_page---------87------------------1,-
Medium.com,Innovation & Tech,Body Positivity Is Lost on YouTube,Digital Life,https://elemental.medium.com/body-positivity-is-lost-on-youtube-230fa6650849?source=topic_page---------88------------------1,-
Medium.com,Innovation & Tech,There’s Finally a Decent Smartwatch for Android,Digital Life,https://onezero.medium.com/theres-finally-a-decent-smartwatch-for-android-b8f4c5c79e36?source=topic_page---------89------------------1,-
Medium.com,Innovation & Tech,Why Does Your Brain Think Influencers Are Your Friends?,Digital Life,https://onezero.medium.com/why-does-your-brain-think-influencers-are-your-friends-68bf56f7d38a?source=topic_page---------90------------------1,-
Medium.com,Innovation & Tech,Should We Stop Saying ‘Men Are Trash’?,Digital Life,https://medium.com/humungus/should-we-stop-saying-men-are-trash-684ec1357440?source=topic_page---------91------------------1,-
Medium.com,Innovation & Tech,You Literally Just Ate Your Phone. Now What?,Digital Life,https://onezero.medium.com/you-literally-just-ate-your-phone-now-what-d64511a8679a?source=topic_page---------92------------------1,-
Medium.com,Innovation & Tech,Revenge Porn is Not About Revenge,Digital Life,https://medium.com/@perspective_zita/revenge-porn-is-not-about-revenge-a965e2d71a2?source=topic_page---------93------------------1,-
Medium.com,Innovation & Tech,Is the Internet A Happy Place?,Digital Life,https://medium.com/swlh/is-the-internet-a-happy-place-4ce0909d25fd?source=topic_page---------94------------------1,-
Medium.com,Innovation & Tech,Should We Be Warning Against Digital Mourning?,Digital Life,https://medium.com/the-public-ear/should-we-be-warning-against-digital-mourning-b9bf112f3057?source=topic_page---------95------------------1,-
Medium.com,Innovation & Tech,Amazon Reviews: Now Worse than Ever,Digital Life,https://medium.com/swlh/amazon-reviews-now-worse-than-ever-26b8e5876aa2?source=topic_page---------96------------------1,-
Medium.com,Innovation & Tech,How to kill your Facebook account without actually deleting it,Digital Life,https://medium.com/swlh/how-to-kill-your-facebook-profile-without-actually-deleting-it-c5cca9882996?source=topic_page---------97------------------1,-
Medium.com,Innovation & Tech,Ransomware Could Be Driving up the Price of Bitcoin,Digital Life,https://onezero.medium.com/ransomware-could-be-driving-up-the-price-of-bitcoin-c5bb96159287?source=topic_page---------98------------------1,-
Medium.com,Innovation & Tech,Digital Déjà Vu,Digital Life,https://psiloveyou.xyz/digital-d%C3%A9j%C3%A0-vu-c09c5ecb8451?source=topic_page---------99------------------1,-
Medium.com,Innovation & Tech,Mark Zuckerberg Is Showing His True Colors,Digital Life,https://medium.com/swlh/mark-zuckerberg-elizabeth-warren-georgetown-university-free-expression-speech-big-tech-bd3711077bc7?source=topic_page---------100------------------1,-
Medium.com,Innovation & Tech,Kindle Hackers Are Disabling Tracking and Ads,Digital Life,https://onezero.medium.com/kindle-hackers-are-disabling-tracking-and-ads-d00d1ad804b0?source=topic_page---------101------------------1,-
Medium.com,Innovation & Tech,Google’s A.I.-Powered Camera Was Destined to Fail,Digital Life,https://onezero.medium.com/googles-a-i-powered-camera-was-destined-to-fail-101810fbc434?source=topic_page---------102------------------1,-
Medium.com,Innovation & Tech,Can Anyone Stop Facebook from Poisoning Democracy?,Digital Life,https://medium.com/swlh/can-anyone-stop-facebook-from-poisoning-democracy-2344b5a2647a?source=topic_page---------103------------------1,-
Medium.com,Innovation & Tech,Facebook Broke My Brain,Digital Life,https://medium.com/@loeywerkingwells/facebook-broke-my-brain-3ddb067961c6?source=topic_page---------104------------------1,-
Medium.com,Innovation & Tech,"Online Dating Isn’t Going Away, But Something Needs To Change",Digital Life,https://humanparts.medium.com/online-dating-isnt-going-away-but-something-needs-to-change-ba2030e81113?source=topic_page---------105------------------1,-
Medium.com,Innovation & Tech,Google’s Quest to Be Everywhere — and Nowhere,Digital Life,https://onezero.medium.com/googles-quest-to-be-everywhere-and-nowhere-323bd14e0a72?source=topic_page---------106------------------1,-
Medium.com,Innovation & Tech,Big Tech has Taken a Page Out of the Big Tobacco Playbook,Digital Life,https://medium.com/swlh/big-tech-has-taken-a-page-out-of-the-big-tobacco-playbook-3fe784a50f4d?source=topic_page---------107------------------1,-
Medium.com,Innovation & Tech,Plus Codes (Open Location Code) and Scripting in Google BigQuery,Digital Life,https://towardsdatascience.com/plus-codes-open-location-code-and-scripting-in-google-bigquery-30b7278f3495?source=topic_page---------108------------------1,-
Medium.com,Innovation & Tech,How the App Store Ended a Golden Era of Software,Digital Life,https://onezero.medium.com/how-the-app-store-ended-a-golden-era-of-software-e7b3217de2f2?source=topic_page---------109------------------1,-
Medium.com,Innovation & Tech,How to Fix Who We are on the Internet,Digital Life,https://medium.com/swlh/how-to-fix-who-we-are-on-the-internet-36397c3a40eb?source=topic_page---------110------------------1,-
Medium.com,Innovation & Tech,The Instagram ‘It Girl’ Paradox,Digital Life,https://medium.com/the-atlantic/the-instagram-it-girl-paradox-50d7912624c3?source=topic_page---------111------------------1,-
