Source,Domain,Heading,Category,URL,Text
Medium.com,Innovation & Tech,Why Can’t We Stop Instagramming Our Books?,Digital Life,https://gen.medium.com/why-cant-we-stop-instagramming-our-books-565b684dbda0?source=topic_page---------112------------------1,-
Medium.com,Innovation & Tech,"Stranger On the Internet, I Don’t Owe You The Level Of Intimacy You Desire",Digital Life,https://medium.com/inside-of-elle-beau/stranger-on-the-internet-i-dont-owe-you-the-level-of-intimacy-you-desire-717df1698948?source=topic_page---------113------------------1,-
Medium.com,Innovation & Tech,The 3 Books To Pick Up If You’re Trying To Put Down Your Phone More Often,Digital Life,https://medium.com/swlh/the-3-books-to-pick-up-if-youre-trying-to-put-down-your-phone-more-often-4cb1a281e84c?source=topic_page---------114------------------1,-
Medium.com,Innovation & Tech,Critics of ContraPoints Keep Missing the Point,Digital Life,https://medium.com/swlh/contrapoints-buck-angel-opulence-controversy-truscum-transmedicalist-non-binary-550c00044534?source=topic_page---------115------------------1,-
Medium.com,Innovation & Tech,What a Compulsive Email Habit Does to Your Mind and Relationships,Digital Life,https://onezero.medium.com/what-a-compulsive-email-habit-does-to-your-mind-and-relationships-f04a20581ca7?source=topic_page---------116------------------1,-
Medium.com,Innovation & Tech,"Google’s Most Interesting Hardware Announcements, Ranked",Digital Life,https://onezero.medium.com/googles-most-interesting-hardware-announcements-ranked-16c77efa37d2?source=topic_page---------117------------------1,-
Medium.com,Innovation & Tech,We’re Living in the Golden Age of Garbage Sons,Digital Life,https://gen.medium.com/were-living-in-the-era-of-the-garbage-sons-c62111ee5ca4?source=topic_page---------118------------------1,-
Medium.com,Innovation & Tech,Every Day Americans Tell Google They Want to Do a Mass Shooting,Digital Life,https://onezero.medium.com/every-day-americans-tell-google-they-want-to-do-a-mass-shooting-9940f1a01934?source=topic_page---------119------------------1,-
Medium.com,Innovation & Tech,All the Times Technology Maybe Saved My Life,Digital Life,https://humanparts.medium.com/all-the-times-technology-maybe-saved-my-life-a9ff486ec756?source=topic_page---------120------------------1,-
Medium.com,Innovation & Tech,"On YouTube, You’re Either a Shane Dawson, or a Logan Paul",Digital Life,https://medium.com/swlh/shane-dawson-logan-jake-paul-demonetization-youtube-rewind-controversy-will-smith-fouseytube-tanacon-76d8eb8884c9?source=topic_page---------121------------------1,-
Medium.com,Innovation & Tech,All the Awful Videos on the Internet,Digital Life,https://medium.com/discourse/all-the-awful-videos-on-the-internet-8fe09d8e2361?source=topic_page---------122------------------1,-
Medium.com,Innovation & Tech,Facebook Is Holding Your Friends Hostage in the Battle for the Smart Home,Digital Life,https://onezero.medium.com/facebook-is-holding-your-friends-hostage-in-the-battle-for-the-smart-home-a105193d7adf?source=topic_page---------123------------------1,-
Medium.com,Innovation & Tech,How Pinterest Built One of Silicon Valley’s Most Successful Algorithms,Digital Life,https://onezero.medium.com/how-pinterest-built-one-of-silicon-valleys-most-successful-algorithms-9101afdfd0dd?source=topic_page---------124------------------1,-
Medium.com,Innovation & Tech,Using TikTok ASMR to Sleep.,Digital Life,https://medium.com/you-seem-fine/using-tiktok-asmr-to-sleep-498e69a13b9?source=topic_page---------125------------------1,-
Medium.com,Innovation & Tech,Conversations with Israeli Explanatory Activists on Quora,Digital Life,https://medium.com/swlh/conversations-with-israeli-explanatory-activists-on-quora-c9dbce25732c?source=topic_page---------126------------------1,-
Medium.com,Innovation & Tech,How Reddit Ushered in My Sexual Renaissance,Digital Life,https://thebolditalic.com/how-reddit-ushered-in-my-sexual-renaissance-bb3b1c19aac2?source=topic_page---------127------------------1,-
Medium.com,Innovation & Tech,What To Do When Your Online Dating Troll Sits Next To You On A 13-Hour Flight,Digital Life,https://medium.com/humungus/what-to-do-when-your-online-dating-trolls-sits-next-to-you-on-a-13-hour-flight-e162741c956d?source=topic_page---------128------------------1,-
Medium.com,Innovation & Tech,You Can’t Always Avoid Drama In Online Writing Communities,Digital Life,https://medium.com/honestly-yours/you-cant-always-avoid-drama-in-online-writing-communities-2dce928cdfbe?source=topic_page---------129------------------1,-
Medium.com,Innovation & Tech,I’m on an App Diet,Digital Life,https://medium.com/swlh/im-on-an-app-diet-de3244c9f802?source=topic_page---------130------------------1,-
Medium.com,Innovation & Tech,The Disturbing State of Big Data,Digital Life,https://medium.com/swlh/the-disturbing-state-of-big-data-8b132e928e8e?source=topic_page---------131------------------1,-
Medium.com,Innovation & Tech,Google Maps Has Changed How We Remember Space,Digital Life,https://onezero.medium.com/google-maps-has-changed-how-we-remember-space-574a7ca4d4c3?source=topic_page---------132------------------1,-
Medium.com,Innovation & Tech,The Original BlackBerry Was Ahead of Its Time,Digital Life,https://onezero.medium.com/the-original-blackberry-was-ahead-of-its-time-e88ccd90684b?source=topic_page---------133------------------1,-
Medium.com,Innovation & Tech,Computer Files Are Going Extinct,Digital Life,https://onezero.medium.com/the-death-of-the-computer-file-doc-43cb028c0506?source=topic_page---------134------------------1,-
