Source,Domain,Heading,Category,URL,Text
Medium.com,Society,"Dear Twitter Mob, College Journalists are Supposed to Make Mistakes",Society,https://gen.medium.com/dear-twitter-mob-college-journalists-are-supposed-to-make-mistakes-bbc5f8887136?source=topic_page---------0------------------1,-
Medium.com,Society,The Honest Truth About Veterans Day,Society,https://medium.com/publishous/the-honest-truth-about-veterans-day-9b8343a72cc2?source=topic_page---------1------------------1,-
Medium.com,Society,"How Platform Technologies Negatively Impact Capitalism, Democracy, and Christianity",Society,https://medium.com/soli-deo-gloria/how-platform-technologies-negatively-impact-capitalism-democracy-and-christianity-d0608d2ca0d0?source=topic_page---------2------------------1,-
Medium.com,Society,Honoring Veterans Means Changing the System That Cares for Them,Society,https://medium.com/@reviveshine/honoring-veterans-means-changing-the-system-that-cares-for-them-5414fe684dcf?source=topic_page---------4------------------1,-
Medium.com,Society,Why We Need Community (even if we don’t agree on everything).,Society,https://medium.com/@samanthaperkins30/why-we-need-community-even-if-we-dont-agree-on-everything-24d43bf86373?source=topic_page---------5------------------1,-
Medium.com,Society,What Should We Do When the World Doesn’t Make Sense,Society,https://medium.com/@hazelclementine/what-should-we-do-when-the-world-doesnt-make-sense-85a5806bb81b?source=topic_page---------6------------------1,-
Medium.com,Society,Learning to Love My Enemies,Society,https://medium.com/@nosaintjennifer/learning-to-love-my-enemies-af2b78e909af?source=topic_page---------7------------------1,-
Medium.com,Society,"Don’t Be an Ally, Be an Accomplice",Society,https://forge.medium.com/dont-be-an-ally-be-an-accomplice-437869756ab5?source=topic_page---------8------------------1,-
Medium.com,Society,What It Means to Walk Around a City Without Purpose,Society,https://zora.medium.com/what-it-means-to-walk-around-a-city-without-purpose-6c84630d86ab?source=topic_page---------9------------------1,-
Medium.com,Society,The Kids Are Online-and Alright,Society,https://medium.com/citrispolicylab/the-kids-are-online-and-alright-8ea3f6362fe8?source=topic_page---------10------------------1,-
Medium.com,Society,You’re More Than Peanut Butter,Society,https://medium.com/@rickieticklez/youre-more-than-peanut-butter-670b6a25f30?source=topic_page---------11------------------1,-
Medium.com,Society,American Resistance,Society,https://arcdigital.media/american-resistance-889e114f3db3?source=topic_page---------12------------------1,-
Medium.com,Society,The Way of the Predator vs the Way of the Nurturer,Society,https://eand.co/the-way-of-the-predator-vs-the-way-of-the-nurturer-3ee308bf3087?source=topic_page---------13------------------1,-
Medium.com,Society,A Reflection of Rural America,Society,https://psiloveyou.xyz/a-reflection-of-rural-america-415a21789ed4?source=topic_page---------14------------------1,-
Medium.com,Society,"There was no generational war, so journalists invented one",Society,https://medium.com/@robs1024/there-was-no-generational-war-so-journalists-invented-one-1a09c5d4c9e1?source=topic_page---------15------------------1,-
Medium.com,Society,Be Kind to Retail Workers This Holiday Season,Society,https://medium.com/an-injustice/be-kind-to-retail-workers-this-holiday-season-153bebadc54c?source=topic_page---------16------------------1,-
Medium.com,Society,Is Science Learning the Deep Lessons of WWI?,Society,https://medium.com/swlh/is-science-learning-the-deep-lessons-of-wwi-a713894e813?source=topic_page---------17------------------1,-
Medium.com,Society,The AI-Powered Future of Drones,Society,https://medium.com/predict/the-ai-powered-future-of-drones-e455777d603a?source=topic_page---------18------------------1,-
Medium.com,Society,Getting Fired Over Politics On Social Media,Society,https://medium.com/discourse/getting-fired-over-politics-on-social-media-3ef3ac860397?source=topic_page---------19------------------1,-
Medium.com,Society,What It Means to Be Single,Society,https://medium.com/@thedatingtruth/what-it-means-to-be-single-8c305abc8566?source=topic_page---------20------------------1,-
Medium.com,Society,The Diet That Was Supposed to Feed the World Forgot to Factor in the Poor,Society,https://onezero.medium.com/the-diet-that-was-supposed-to-feed-the-world-forgot-to-factor-in-the-poor-cd0e223d6945?source=topic_page---------21------------------1,-
Medium.com,Society,"Why Story, Not Science, is Our Best Hope for Surviving 2020",Society,https://medium.com/@jodi_barnes/why-story-not-science-is-our-best-hope-for-surviving-2020-e2ad9fd4fd65?source=topic_page---------22------------------1,-
Medium.com,Society,What Does Lab-Grown Meat Say About Society?,Society,https://medium.com/tenderlymag/what-does-lab-grown-meat-say-about-society-7274205047ea?source=topic_page---------23------------------1,-
Medium.com,Society,A San Francisco War Vet Speaks Out about Veterans Day,Society,https://thebolditalic.com/a-san-francisco-war-vet-speaks-out-about-veterans-day-the-bold-italic-san-francisco-9fd535407a19?source=topic_page---------24------------------1,-
Medium.com,Society,What the Godfather of Spin Teaches Us About Trump,Society,https://gen.medium.com/secrets-of-a-right-wing-opinion-maker-bbeba55a44bd?source=topic_page---------25------------------1,-
Medium.com,Society,Boeing and the Value of Human Life,Society,https://medium.com/@ramman_erin/boeing-and-the-value-of-human-life-168cb8a5c188?source=topic_page---------26------------------1,-
Medium.com,Society,The Road We’re Travelling: Driving Drunk With Donald Trump,Society,https://medium.com/@maxgordon19/the-road-were-travelling-driving-drunk-with-donald-trump-3bf0ea4c9619?source=topic_page---------27------------------1,-
Medium.com,Society,Let’s be more curious and less nosy,Society,https://medium.com/@joannescarlet/lets-be-more-curious-and-less-nosy-f3a3ebee6315?source=topic_page---------28------------------1,-
Medium.com,Society,I Will Never Again Use the Term “My Tribe”,Society,https://medium.com/the-partnered-pen/i-will-never-again-use-the-term-my-tribe-639467d419f8?source=topic_page---------29------------------1,-
Medium.com,Society,The Burden of Convenience,Society,https://medium.com/@tmjipp/the-burden-of-convenience-27ce4be5f2ad?source=topic_page---------30------------------1,-
Medium.com,Society,Finding Self-Respect Whether Employed or Not,Society,https://medium.com/@shirleydavis_23968/finding-self-respect-whether-employed-or-not-de7f316a712d?source=topic_page---------31------------------1,-
Medium.com,Society,American conformity and the car park,Society,https://medium.com/@mgpowell/american-conformity-and-the-car-park-7ba7d91b6ce6?source=topic_page---------32------------------1,-
Medium.com,Society,What does it mean to be an ethical software company?,Society,https://medium.com/swlh/what-does-it-mean-to-be-an-ethical-software-company-60ec7f18360f?source=topic_page---------33------------------1,-
Medium.com,Society,What do Donald Trump and Christianity have in common?,Society,https://medium.com/@iamcicero/what-do-donald-trump-and-christianity-have-in-common-7188984c8a4a?source=topic_page---------34------------------1,-
Medium.com,Society,A Brief Dark History of Adoption,Society,https://medium.com/@demanuelclemen/a-brief-dark-history-of-adoption-217f2e3d5a64?source=topic_page---------35------------------1,-
Medium.com,Society,Why “Culture Fit” Might Be Disadvantageous to First-Generation Professionals,Society,https://medium.com/swlh/why-culture-fit-might-be-disadvantageous-to-first-generation-professionals-1503de4f05a7?source=topic_page---------36------------------1,-
Medium.com,Society,The Curious History of Pumpkin Spice,Society,https://medium.com/@rachelwayne/the-curious-history-of-pumpkin-spice-cee351fd8f66?source=topic_page---------38------------------1,-
Medium.com,Society,Untitled story,Society,https://medium.com/the-partnered-pen/i-separate-the-artist-from-the-art-to-not-reduce-the-movement-or-the-art-6cfa13ff5946?source=topic_page---------39------------------1,-
Medium.com,Society,Why Would you Want to be the Same as Everybody Else?,Society,https://medium.com/@KittyHannahEden/why-would-you-want-to-be-the-same-as-everybody-else-531f85d2fdbf?source=topic_page---------40------------------1,-
Medium.com,Society,Science is critical to consider for ensuring actions align with values,Society,https://medium.com/@taiarima/science-is-critical-to-consider-for-ensuring-actions-align-with-values-c95f23773022?source=topic_page---------41------------------1,-
Medium.com,Society,"Starving, Hysterical, Naked",Society,https://medium.com/@zoeyhickman/starving-hysterical-naked-69f3d9e1c228?source=topic_page---------43------------------1,-
Medium.com,Society,‘Appropriation Is an Undeniable Fact of Human Interaction’,Society,https://heated.medium.com/appropriation-is-an-undeniable-fact-of-human-interaction-4fc361d1c399?source=topic_page---------44------------------1,-
Medium.com,Society,Ultraprocessed Food Is Linked to Obesity and Disease — So Why Are We Feeding It to Our Kids?,Society,https://heated.medium.com/ultraprocessed-food-is-linked-to-obesity-and-disease-so-why-are-we-feeding-it-to-our-kids-9d90bc1eafc?source=topic_page---------45------------------1,-
Medium.com,Society,Why Books are Important,Society,https://medium.com/writers-blog/why-books-are-important-cab62ef9985f?source=topic_page---------46------------------1,-
Medium.com,Society,Shame: All the Terrible Things We Never Did,Society,https://medium.com/@melissatoldy/shame-all-the-terrible-things-we-never-did-1f460bdd16d4?source=topic_page---------47------------------1,-
Medium.com,Society,The Evil of Neutrality,Society,https://medium.com/swlh/the-evil-of-neutrality-225d47dfcb7a?source=topic_page---------48------------------1,-
Medium.com,Society,Black Mothers in Chicago Are the Village Against Gun Violence,Society,https://zora.medium.com/black-mothers-in-chicago-are-the-village-against-gun-violence-19d56027756e?source=topic_page---------49------------------1,-
Medium.com,Society,Summary & Review: Utopia for Realists by Rutger Bregman,Society,https://medium.com/@econsystemsthinking/summary-review-utopia-for-realists-by-rutger-bregman-437c506f329c?source=topic_page---------50------------------1,-
Medium.com,Society,Untitled story,Society,https://medium.com/the-helm/why-social-justice-causes-need-to-stop-being-coy-and-start-making-money-36cedd0d281e?source=topic_page---------51------------------1,-
Medium.com,Society,"Black Parents, None But Ourselves Can Free Our Minds…",Society,https://medium.com/@melissamatthews_37885/black-parents-none-but-ourselves-can-free-our-minds-84ff450d143e?source=topic_page---------52------------------1,-
Medium.com,Society,"Dear OK Boomers: Power is Taken, not Given",Society,https://medium.com/@lindafalcao/dear-ok-boomers-power-is-taken-not-given-a78f995bdd26?source=topic_page---------53------------------1,-
Medium.com,Society,Have We Hit Peak Whiteness?,Society,https://medium.com/nautilus-magazine/have-we-hit-peak-whiteness-e143d77eb64f?source=topic_page---------54------------------1,-
Medium.com,Society,A New Yorker’s Guide to Embracing Diversity,Society,https://medium.com/@melissatoldy/a-new-yorkers-guide-to-embracing-diversity-a8ff557601d?source=topic_page---------55------------------1,-
Medium.com,Society,"The 10 Types of Tippers, According to Servers",Society,https://thebolditalic.com/the-10-types-of-tippers-according-to-servers-b2efb005574f?source=topic_page---------56------------------1,-
Medium.com,Society,Political Arguments Upset Me but I Was Wrong to Withdraw,Society,https://medium.com/human-spiral/political-infighting-makes-me-anxious-but-i-was-wrong-to-lose-interest-ff434c98fb19?source=topic_page---------57------------------1,-
Medium.com,Society,Leadership We Could Have Had,Society,https://medium.com/@markinky/leadership-we-could-have-had-2aeacd724920?source=topic_page---------58------------------1,-
Medium.com,Society,When did busy become so cool?,Society,https://medium.com/swlh/when-did-busy-become-so-cool-41d45243f939?source=topic_page---------59------------------1,-
Medium.com,Society,This Week in Misogyny: T.I. Visits the Gynecologist,Society,https://medium.com/@rachaelhope/this-week-in-misogyny-t-i-visits-the-gynecologist-65ba80c1a774?source=topic_page---------60------------------1,-
Medium.com,Society,Brokering Bricks: The World of Lego Investing,Society,https://medium.com/wisecrack/brokering-bricks-the-world-of-lego-investing-66d1a59fc206?source=topic_page---------61------------------1,-
Medium.com,Society,This is Not Cultural Appropriation,Society,https://medium.com/@HinesAmandaJ/this-is-not-cultural-appropriation-8249a5f3f4e6?source=topic_page---------62------------------1,-
Medium.com,Society,Please Talk Quietly in Seoul’s Hanok Villages,Society,https://medium.com/the-conscious-traveller/please-talk-quietly-in-seouls-hanok-villages-55781711d0b0?source=topic_page---------63------------------1,-
Medium.com,Society,Life begins at conception and other unhelpful assumptions…even if you believe them,Society,https://medium.com/@dissentingpilgrim/life-begins-at-conception-and-other-unhelpful-assumptions-even-if-you-believe-them-742ff7372898?source=topic_page---------64------------------1,-
Medium.com,Society,Is the Climate Crisis putting a tax on your relationships?,Society,https://medium.com/@christylrivers/is-the-climate-crisis-putting-a-tax-on-your-relationships-a3496f2c8ec?source=topic_page---------65------------------1,-
Medium.com,Society,"Iraq is Healing: The October Revolution, Systemic Change and Intergenerational Trauma",Society,https://medium.com/@WATM/iraq-is-healing-the-october-revolution-systemic-change-and-intergenerational-trauma-2d8bc798901e?source=topic_page---------66------------------1,-
Medium.com,Society,"How to Support Your Fat Friends, as a Straight Size Person",Society,https://humanparts.medium.com/what-i-appreciate-most-from-thinner-friends-2c1524ae09c9?source=topic_page---------67------------------1,-
Medium.com,Society,The Age of the Superplatform,Society,https://medium.com/swlh/the-age-of-the-superplatform-18546fa77680?source=topic_page---------68------------------1,-
Medium.com,Society,Extra-Special Snowflakes,Society,https://medium.com/swlh/extra-special-snowflakes-7b1a3d699b3b?source=topic_page---------69------------------1,-
Medium.com,Society,"(Why) The Price of Capitalism is Serfdom, Via Fascism",Society,https://eand.co/why-the-price-of-capitalism-is-serfdom-via-fascism-19c9e8155cff?source=topic_page---------70------------------1,-
Medium.com,Society,The Only Photo Taken of the Entire Earth By a Person,Society,https://medium.com/swlh/the-only-photo-taken-of-the-entire-earth-by-a-person-cb4913a7ba78?source=topic_page---------71------------------1,-
Medium.com,Society,The President Threatens California AGAIN,Society,https://medium.com/@nadinbrzezinski/the-president-threatens-california-again-7c7fc7a77e7a?source=topic_page---------72------------------1,-
Medium.com,Society,Gilding the Silly,Society,https://medium.com/@bccwhinney/gilding-the-silly-f44383d4ce36?source=topic_page---------73------------------1,-
Medium.com,Society,How To Tell If He’s A Real Man or Not,Society,https://psiloveyou.xyz/how-to-tell-if-hes-a-real-man-or-not-3fbb0d77dc27?source=topic_page---------74------------------1,-
Medium.com,Society,The Economist Who Wants To Ditch Math,Society,https://marker.medium.com/robert-shiller-says-economics-needs-to-go-viral-to-save-itself-f157eceb4c7d?source=topic_page---------75------------------1,-
Medium.com,Society,Cancel Culture: Just Another Form of Bullying?,Society,https://medium.com/what-to-do-about-everything/cancel-culture-just-another-form-of-bullying-5524d208493c?source=topic_page---------76------------------1,-
Medium.com,Society,Bringing Back Civil Discourse,Society,https://medium.com/an-injustice/bringing-back-civil-discourse-1da83f31446?source=topic_page---------77------------------1,-
Medium.com,Society,"Honestly, Honesty is a Good Thing",Society,https://medium.com/life-unplugged/honestly-honesty-is-a-good-thing-555b4c42b96b?source=topic_page---------78------------------1,-
Medium.com,Society,In the Northeast — Millennials Choose New Hampshire,Society,https://medium.com/@CosmoMacero/in-the-northeast-millennials-choose-new-hampshire-dfa1ee6f141c?source=topic_page---------79------------------1,-
Medium.com,Society,Lessons in setting up a community project,Society,https://medium.com/@justclembo/lessons-in-setting-up-a-community-project-f4cfcbeccae?source=topic_page---------80------------------1,-
Medium.com,Society,Masculinity Is Masking Anxiety,Society,https://elemental.medium.com/masculinity-is-masking-anxiety-f5458eb3ab87?source=topic_page---------81------------------1,-
Medium.com,Society,The Heartland Billionaire Destroying the Working Class,Society,https://gen.medium.com/the-heartland-billionaire-destroying-the-working-class-2da8f78320cd?source=topic_page---------82------------------1,-
Medium.com,Society,You’re Not for Family Values if You’re Shopping on Thanksgiving,Society,https://medium.com/@muiraedkenney/youre-not-for-family-values-if-you-re-shopping-on-thanksgiving-a72b677225c2?source=topic_page---------83------------------1,-
Medium.com,Society,The Struggle for Global Consciousness,Society,https://eand.co/the-struggle-for-global-consciousness-32cb7f9166ae?source=topic_page---------84------------------1,-
Medium.com,Society,Capital One’s Outage Totally Screwed Over the Working Class,Society,https://gen.medium.com/what-the-capital-one-outage-reveals-about-the-working-class-902f8dd59b02?source=topic_page---------85------------------1,-
Medium.com,Society,What type of questions do people ask British politicians in online Q&As?,Society,https://medium.com/swlh/what-type-of-questions-do-people-ask-british-politicians-in-online-q-as-e8aaa2f6315f?source=topic_page---------86------------------1,-
Medium.com,Society,Politicians dodging questions: How much do British politicians equivocate in online Q&As?,Society,https://medium.com/swlh/politicians-dodging-questions-how-much-do-british-politicians-equivocate-in-online-q-as-358fd981bca1?source=topic_page---------87------------------1,-
Medium.com,Society,Legacy of a Child Bride,Society,https://medium.com/fearless-she-wrote/legacy-of-a-child-bride-4346626a5a70?source=topic_page---------88------------------1,-
Medium.com,Society,"Tell me, am I spoiled?",Society,https://medium.com/@tiffany.sun/tell-me-am-i-spoiled-8ba8aa9ca1dc?source=topic_page---------89------------------1,-
Medium.com,Society,Let’s Drop The Generational Blame-Game,Society,https://medium.com/@chrisjones_32882/lets-drop-the-generational-blame-game-2719c72db0e9?source=topic_page---------90------------------1,-
Medium.com,Society,"Stories From the Saddle — Reflections on Racing, Riding and Living with Horses",Society,https://medium.com/swlh/stories-from-the-saddle-reflections-on-racing-riding-and-living-with-horses-b4db0354206e?source=topic_page---------91------------------1,-
Medium.com,Society,Paid Parental Leave Would Change Society,Society,https://medium.com/swlh/paid-parental-leave-would-change-society-d29cd5fb1cad?source=topic_page---------92------------------1,-
Medium.com,Society,Undercover in the Orthodox Underworld,Society,https://gen.medium.com/undercover-in-the-orthodox-underworld-83c61ba3aa83?source=topic_page---------93------------------1,-
Medium.com,Society,America Has a Benzo Problem,Society,https://elemental.medium.com/the-benzo-problem-6e1078bd5152?source=topic_page---------94------------------1,-
Medium.com,Society,"Obama Just Called Out Woke Culture, Will the Internet Mobs Listen?",Society,https://medium.com/4th-wave-feminism/obama-just-called-out-woke-culture-will-the-internet-mobs-listen-7d0059a10788?source=topic_page---------95------------------1,-
Medium.com,Society,Let’s turn boys into happily vulnerable men,Society,https://medium.com/@willmruzek/lets-turn-boys-into-happily-vulnerable-men-402384fd62e6?source=topic_page---------96------------------1,-
Medium.com,Society,"Inside Discord’s Unmoderated, Potentially Dangerous Teen Dating Network",Society,https://onezero.medium.com/despite-strict-ban-discord-is-a-hub-for-potentially-dangerous-underage-dating-6749383f5e90?source=topic_page---------97------------------1,-
Medium.com,Society,About Your Skin,Society,https://medium.com/nautilus-magazine/about-your-skin-8882a8d5c063?source=topic_page---------98------------------1,-
Medium.com,Society,How Godzilla Changed,Society,https://medium.com/wisecrack/how-godzilla-changed-986823693687?source=topic_page---------99------------------1,-
Medium.com,Society,"Eddie Murphy’s Comedy Evolution, From ‘Delirious’ to ‘Dolemite’",Society,https://gen.medium.com/from-delirious-to-dolemite-eddie-murphys-comedy-evolution-ab0457ce84b3?source=topic_page---------100------------------1,-
Medium.com,Society,Power to the Powerless: An Interview With Mona Chalabi,Society,https://medium.com/nightingale/power-to-the-powerless-an-interview-with-mona-chalabi-39d73647d80a?source=topic_page---------101------------------1,-
Medium.com,Society,The Age of Addiction. Why?,Society,https://medium.com/swlh/the-age-of-addiction-why-18794a51087d?source=topic_page---------102------------------1,-
Medium.com,Society,How to Design for Assholes,Society,https://modus.medium.com/product-design-the-asshole-contingency-296ed8a50e21?source=topic_page---------103------------------1,-
Medium.com,Society,"Deadspin, of All Places",Society,https://gen.medium.com/deadspin-of-all-places-8e03d475af63?source=topic_page---------104------------------1,-
Medium.com,Society,Feeding the future: how can we fix the world’s faulty food system,Society,https://medium.com/telegraph/fix-food-system-climate-change-36ff8ff7e55c?source=topic_page---------105------------------1,-
Medium.com,Society,I Changed My Name to Honor My People,Society,https://medium.com/broads-non-grata/i-changed-my-name-to-honor-my-people-3a5648ba669f?source=topic_page---------106------------------1,-
Medium.com,Society,What Caused the Student Loan Crisis?,Society,https://medium.com/med-daily/what-caused-the-student-loan-crisis-16082a80d442?source=topic_page---------107------------------1,-
Medium.com,Society,When the Rich Refuse to Die,Society,https://medium.com/@thomascrane92/when-the-rich-refuse-to-die-1323eb5a0232?source=topic_page---------108------------------1,-
Medium.com,Society,What Do Monuments Reveal About Their Makers?,Society,https://medium.com/sapiens-org/what-do-monuments-reveal-about-their-makers-b7f3565792c4?source=topic_page---------109------------------1,-
Medium.com,Society,Is It Personal or Business When It Comes to Childcare? It’s Both,Society,https://medium.com/apparently/is-it-personal-or-business-when-it-comes-to-childcare-its-both-11dee95b9edc?source=topic_page---------110------------------1,-
Medium.com,Society,Rugged Individualism and The Increase in Isolation,Society,https://blog.usejournal.com/rugged-individualism-and-the-increase-in-isolation-2c5020bccbda?source=topic_page---------111------------------1,-
Medium.com,Society,The Halloween Wars: Who Gets Candy and Who Doesn’t?,Society,https://zora.medium.com/the-halloween-wars-who-gets-candy-and-who-doesnt-dd92f0cc33f2?source=topic_page---------112------------------1,-
Medium.com,Society,Austerity Is an Algorithm,Society,https://medium.com/logic-magazine/austerity-is-an-algorithm-2e87c9e9133f?source=topic_page---------113------------------1,-
Medium.com,Society,Blueprint for Revolution: Laugh Your Way to Victory,Society,https://medium.com/better-humans/blueprint-for-revolution-laugh-your-way-to-victory-6e9565b09d5?source=topic_page---------114------------------1,-
Medium.com,Society,Too Fat for Uber,Society,https://medium.com/@Shesreallyfat/too-fat-for-uber-2a16714e279f?source=topic_page---------115------------------1,-
Medium.com,Society,The Toxic Bubble of Technical Debt Threatening America,Society,https://medium.com/the-atlantic/the-toxic-bubble-of-technical-debt-threatening-america-73d5a4bc8e1c?source=topic_page---------116------------------1,-
Medium.com,Society,Choosing a Halloween Costume Using the Google Trends API in Python,Society,https://towardsdatascience.com/choosing-a-halloween-costume-using-the-google-trends-api-in-python-a3206b78a2a2?source=topic_page---------117------------------1,-
Medium.com,Society,How Do You Define a Man?,Society,https://medium.com/the-ascent/how-do-you-define-a-man-3fd20a393229?source=topic_page---------118------------------1,-
Medium.com,Society,Can Science Teach Us Right and Wrong?,Society,https://medium.com/thinksheet/can-science-teach-us-right-and-wrong-df5efa7a45a7?source=topic_page---------119------------------1,-
Medium.com,Society,The Teen Who Cried “There’s a Rapist in Our School”,Society,https://medium.com/swlh/the-teen-who-cried-theres-a-rapist-in-our-school-69a7786a37c9?source=topic_page---------120------------------1,-
Medium.com,Society,"Halloween Costumes, Cultural Appropriation, and The Death of Fun",Society,https://medium.com/@joegarza66/halloween-costumes-cultural-appropriation-and-the-death-of-fun-9ebbc0cd5d8b?source=topic_page---------121------------------1,-
Medium.com,Society,Does Voting With Your Wallet Work?,Society,https://medium.com/the-conscious-dollar/does-voting-with-your-wallet-work-3e4c7106b21?source=topic_page---------122------------------1,-
Medium.com,Society,A Lebanese Dream: From Yesterday to Tomorrow,Society,https://medium.com/@marwan5764/a-lebanese-dream-from-yesterday-to-tomorrow-f36d63cf4577?source=topic_page---------123------------------1,-
Medium.com,Society,GenZ Has No American Dream,Society,https://medium.com/dweeb-ideas/genz-has-no-american-dream-86dca7e500eb?source=topic_page---------124------------------1,-
