Source,Domain,Heading,Category,URL,Text
Medium.com,Society,Medical Emergencies in Flight: Tech to the Rescue,Transportation,https://medium.com/datadriveninvestor/medical-emergencies-in-flight-tech-to-the-rescue-81dba53aef66?source=topic_page---------0------------------1,-
Medium.com,Society,San Francisco’s Prop D,Transportation,https://medium.com/@huntercutting/san-franciscos-prop-d-d4ac6182ef93?source=topic_page---------1------------------1,-
Medium.com,Society,Smart electric vehicle charging,Transportation,https://medium.com/digitalagenda/smart-electric-vehicle-charging-4194df64ba5b?source=topic_page---------2------------------1,-
Medium.com,Society,Should You Buy An Electric Car To Reduce Your Environmental Impact?,Transportation,https://medium.com/@tabitha.whiting/should-you-buy-an-electric-car-to-reduce-your-environmental-impact-cd5d05cfbf00?source=topic_page---------4------------------1,-
Medium.com,Society,Riding Dirty: Waymo and the Climate Cost of Autonomous Mobility (as Currently Conceived),Transportation,https://medium.com/@joseph.wildey/riding-dirty-waymo-and-the-climate-cost-of-autonomous-mobility-as-currently-conceived-9fa34b4f76f4?source=topic_page---------5------------------1,-
Medium.com,Society,The Pedicab Drivers of Savannah,Transportation,https://medium.com/@maddie1b11/the-pedicab-drivers-of-savannah-339e86501ccc?source=topic_page---------7------------------1,-
Medium.com,Society,"Ghosts, swings, and zoning",Transportation,https://medium.com/@amydain/ghosts-swings-and-zoning-bc782c718e81?source=topic_page---------8------------------1,-
Medium.com,Society,We Sacrificed Our New Car for the Environment,Transportation,https://medium.com/@jasonjamesweiland/we-sacrificed-our-new-car-for-the-environment-704fb1d4dc2c?source=topic_page---------9------------------1,-
Medium.com,Society,10 Ways to Read the Road Like a Book & Feel Safer Biking in Your City,Transportation,https://medium.com/@abby.brockman/10-ways-to-read-the-road-like-a-book-feel-safer-biking-in-your-city-da954855db80?source=topic_page---------10------------------1,-
Medium.com,Society,"“There Are No Old, Bold Pilots”",Transportation,https://medium.com/@plittle/there-are-no-old-bold-pilots-3237b2246e65?source=topic_page---------11------------------1,-
Medium.com,Society,EU emissions: will this be transport’s last lost decade?,Transportation,https://medium.com/@transenv/eu-emissions-will-this-be-transports-last-lost-decade-803fd09e0a23?source=topic_page---------12------------------1,-
Medium.com,Society,Uber Drivers Protest ‘Corporate Greed’ as Billionaires Cash In,Transportation,https://onezero.medium.com/uber-drivers-protest-corporate-greed-as-billionaires-cash-in-df65a7e470a7?source=topic_page---------13------------------1,-
Medium.com,Society,"What’s It’s Like to Fly an 11,500-Pound Experimental Helicopter (With Zero Experience)",Transportation,https://medium.com/popular-science/whats-it-s-like-to-fly-an-11-500-pound-experimental-helicopter-with-zero-experience-8028bcc5fc13?source=topic_page---------14------------------1,-
Medium.com,Society,We staged a mass protest against the MTA and NYPD,Transportation,https://medium.com/@anastasiatomkin/we-staged-a-mass-protest-against-the-mta-and-nypd-62901edfae1f?source=topic_page---------15------------------1,-
Medium.com,Society,How to Save on App Development at the Time of Large-Scale Change in Car Connectivity?,Transportation,https://medium.com/creating-automotive-experience-of-tomorrow-today/cost-effective-delivery-of-connected-car-software-af452efd00a9?source=topic_page---------16------------------1,-
Medium.com,Society,Airlines Counter Flight Shaming By Lobbying for More Outside Investments,Transportation,https://medium.com/@PassBlue2016/airlines-counter-flight-shaming-by-lobbying-for-more-outside-investments-2dba89a59c1e?source=topic_page---------17------------------1,-
Medium.com,Society,"By Siding With Trump, Automakers Are Guaranteeing They’ll Need Another Government Bailout",Transportation,https://medium.com/@ericjscholl/by-siding-with-trump-automakers-are-guaranteeing-theyll-need-another-government-bailout-391729e3034?source=topic_page---------18------------------1,-
Medium.com,Society,The economics of electrified vehicles in 2019,Transportation,https://medium.com/@luc_23423/the-economics-of-electrified-vehicles-in-2019-62863b6bf1c7?source=topic_page---------19------------------1,-
Medium.com,Society,Walking is Confusing in California,Transportation,https://psiloveyou.xyz/walking-is-confusing-in-california-9354b48ae22a?source=topic_page---------20------------------1,-
Medium.com,Society,San Francisco has a massive yet solvable unprotected bike lane problem,Transportation,https://medium.com/swlh/san-francisco-has-a-massive-yet-solvable-unprotected-bike-lane-problem-3c3c0c5739c7?source=topic_page---------21------------------1,-
Medium.com,Society,Switched Transport Network for Personal Mobility Pods,Transportation,https://medium.com/swlh/switched-transport-network-for-personal-mobility-pods-45672f39756?source=topic_page---------22------------------1,-
Medium.com,Society,New Experimental EV Battery Design Can Charge in Just 10 Minutes,Transportation,https://medium.com/extremetech-access/new-experimental-ev-battery-design-can-charge-in-just-10-minutes-d5566750d248?source=topic_page---------23------------------1,-
Medium.com,Society,What’s the Deal With the Tesla Model 3?,Transportation,https://medium.com/swlh/whats-the-deal-with-the-tesla-model-3-f02282ce43b4?source=topic_page---------24------------------1,-
Medium.com,Society,The Best Way To Plan An Electric Car Road Trip,Transportation,https://medium.com/@evan.robertson77/the-best-way-to-plan-an-electric-car-road-trip-207b4068956e?source=topic_page---------25------------------1,-
Medium.com,Society,OnMyWay Promises ‘Cash’ for Driving Safe — But There’s a Catch,Transportation,https://onezero.medium.com/onmyway-promises-cash-for-driving-safe-but-there-s-a-big-catch-345686cbef00?source=topic_page---------26------------------1,-
Medium.com,Society,"Urban transportation is being disrupted, but it isn’t big tech that’s doing it",Transportation,https://medium.com/@tbabin/urban-transportation-is-being-disrupted-but-it-isnt-big-tech-that-s-doing-it-dc147d71e69c?source=topic_page---------27------------------1,-
Medium.com,Society,"Fast, Frequent and Reliable Mass Transit",Transportation,https://medium.com/@brendon_harre/fast-frequent-and-reliable-mass-transit-dc97bdd1ce60?source=topic_page---------28------------------1,-
Medium.com,Society,Relearning the value of testing at the MTA,Transportation,https://medium.com/@jgee/relearning-the-value-of-testing-at-the-mta-7bdaa4dfb4ce?source=topic_page---------29------------------1,-
Medium.com,Society,German cities ban old diesel cars. But — is the air any cleaner?,Transportation,https://medium.com/@blazej.kupec/german-cities-ban-old-diesel-cars-but-is-the-air-any-cleaner-f7d185021508?source=topic_page---------30------------------1,-
Medium.com,Society,What Happens if You Try to Hijack a ZipCar to Mexico?,Transportation,https://onezero.medium.com/what-happens-if-you-try-to-hijack-a-zipcar-to-mexico-a514503b210?source=topic_page---------31------------------1,-
Medium.com,Society,Urban Air Mobility — “It’s the logistics stupid”,Transportation,https://medium.com/swlh/urban-air-mobility-its-the-logistics-stupid-82d475f4aaa9?source=topic_page---------32------------------1,-
Medium.com,Society,Be Safe,Transportation,https://medium.com/swlh/be-safe-4047177538f3?source=topic_page---------33------------------1,-
Medium.com,Society,Why are Uber Drivers Urinating in Cups and Disposable Bottles?,Transportation,https://medium.com/the-gotham-grind/why-are-uber-drivers-urinating-in-cups-and-disposable-bottles-844ce1841b44?source=topic_page---------34------------------1,-
Medium.com,Society,Debunking the 4 Myths in Mobility-as-a-Service,Transportation,https://medium.com/@AsterCapital/debunking-the-4-myths-in-mobility-as-a-service-3baeb7a6861d?source=topic_page---------35------------------1,-
Medium.com,Society,"The Future of Mobility is Electric, Autonomous and Shared",Transportation,https://medium.com/swlh/the-future-of-mobility-is-electric-autonomous-and-shared-1b1f724b9de5?source=topic_page---------36------------------1,-
Medium.com,Society,The Boring Company: The Snail-Paced Tunneling Frontier,Transportation,https://medium.com/@creesnick/the-boring-company-the-snail-paced-tunneling-frontier-41e996a18324?source=topic_page---------37------------------1,-
Medium.com,Society,"The cyclist’s dilemma: How safety, climate and air pollution collide on America’s roadways",Transportation,https://medium.com/u-s-pirg/the-cyclists-dilemma-how-safety-climate-and-air-pollution-collide-on-america-s-roadways-u-s-d143e3258511?source=topic_page---------38------------------1,-
Medium.com,Society,Florida Claims to be a Driverless Car Paradise. Critics Call It a Lawless Mess,Transportation,https://onezero.medium.com/florida-is-racing-full-speed-to-become-the-home-state-for-autonomous-vehicles-9c87e46fca9c?source=topic_page---------39------------------1,-
Medium.com,Society,The most effective solution for global poverty isn’t what you’d expect,Transportation,https://medium.com/@craig.kielburger/the-most-effective-solution-for-global-poverty-isnt-what-you-d-expect-f57207b8b16b?source=topic_page---------40------------------1,-
Medium.com,Society,The Silent City,Transportation,https://medium.com/@martinedic/the-silent-city-7ceca83c92af?source=topic_page---------41------------------1,-
Medium.com,Society,PHOTOS: The Subversive Joy of ‘Babes’ on Bikes,Transportation,https://thebolditalic.com/photos-the-subversive-joy-of-babes-on-bikes-145b70f17a47?source=topic_page---------42------------------1,-
Medium.com,Society,The Bicycle Can Save America!,Transportation,https://medium.com/riding-in-traffic-with-cars/the-bicycle-can-save-america-7375f5cbead3?source=topic_page---------43------------------1,-
Medium.com,Society,Three major technological changes that are going to redefine the automotive sector and change our…,Transportation,https://medium.com/enrique-dans/three-major-technological-changes-that-are-going-to-redefine-the-automotive-sector-and-change-our-67dbe2bd2c2a?source=topic_page---------44------------------1,-
Medium.com,Society,SHTHPNS: The Never-Ending Free Speech Fight Over Vanity License Plates,Transportation,https://gen.medium.com/shthpns-the-never-ending-free-speech-fight-over-vanity-license-plates-a16e89ea6ef7?source=topic_page---------45------------------1,-
Medium.com,Society,Can We Please Embrace Kindness On the Road?,Transportation,https://medium.com/@kedillon/can-we-please-embrace-kindness-on-the-road-23b36ae1299d?source=topic_page---------46------------------1,-
Medium.com,Society,Should We Outlaw SUVs?,Transportation,https://medium.com/fast-company/should-we-outlaw-suvs-ad45b0e05955?source=topic_page---------47------------------1,-
Medium.com,Society,Reclaiming the Commons: The Case for Public Bike Libraries,Transportation,https://medium.com/swlh/https-medium-com-asherofla-reclaiming-the-commons-a4711a064f91?source=topic_page---------48------------------1,-
Medium.com,Society,A Kickstarter Campaign for Bus Rapid Transit: Lessons from Bogotá and Cartagena,Transportation,https://medium.com/@joel.epstein/a-kickstarter-campaign-for-bus-rapid-transit-lessons-from-bogot%C3%A1-and-cartagena-91739399ab2?source=topic_page---------49------------------1,-
Medium.com,Society,Green Infrastructure: The Forgotten Part of a Climate Change Agenda,Transportation,https://medium.com/@jtrea81/green-infrastructure-the-forgotten-part-of-a-climate-change-agenda-a0544581aaaf?source=topic_page---------50------------------1,-
Medium.com,Society,What’s the fascination with electric cars?,Transportation,https://medium.com/@evan.robertson77/whats-the-fascination-with-electric-cars-e1db9dcb03b1?source=topic_page---------51------------------1,-
Medium.com,Society,Less parking can mean more housing. Here’s how.,Transportation,https://medium.com/sidewalk-talk/less-parking-can-mean-more-housing-heres-how-14b9e50fe646?source=topic_page---------52------------------1,-
Medium.com,Society,"My Dad’s a Pilot, and I’m Afraid of Flying",Transportation,https://medium.com/@Bockles/my-dads-a-pilot-and-i-m-afraid-of-flying-d4c4ae73c41?source=topic_page---------53------------------1,-
Medium.com,Society,A Web of ‘Partner’ Companies Keeps Uber Out of Trouble in Poland,Transportation,https://onezero.medium.com/a-web-of-partner-companies-keeps-uber-out-of-trouble-in-poland-ee8a82fffcd2?source=topic_page---------54------------------1,-
Medium.com,Society,Why can’t buses get no respect?,Transportation,https://medium.com/@brigittepellerin/why-cant-buses-get-no-respect-800be416c912?source=topic_page---------55------------------1,-
Medium.com,Society,Design and the art of motorcycle maintenance,Transportation,https://uxdesign.cc/design-and-the-art-of-motorcycle-maintenance-f04ca48de1ad?source=topic_page---------56------------------1,-
Medium.com,Society,Are Hyperloops Good Investment?,Transportation,https://medium.com/datadriveninvestor/are-hyperloops-good-investment-32281ebc58ae?source=topic_page---------57------------------1,-
Medium.com,Society,How I Learned to Stop Griping and Love Electric Scooters,Transportation,https://medium.com/fast-company/how-i-learned-to-stop-griping-and-love-electric-scooters-9cf74a9fbc54?source=topic_page---------58------------------1,-
Medium.com,Society,The automobile sector is finally moving toward electric vehicles… but not fast enough,Transportation,https://medium.com/enrique-dans/the-automobile-sector-is-finally-moving-toward-electric-vehicles-but-not-fast-enough-29c837b43591?source=topic_page---------59------------------1,-
Medium.com,Society,Live Prediction of Traffic Accident Risks Using Machine Learning and Google Maps,Transportation,https://towardsdatascience.com/live-prediction-of-traffic-accident-risks-using-machine-learning-and-google-maps-d2eeffb9389e?source=topic_page---------60------------------1,-
Medium.com,Society,A Framework for when Ride-Hailing/Sharing Companies and Public Transit Agencies may work together…,Transportation,https://medium.com/@MarkZannoni/a-framework-for-when-ride-hailing-sharing-companies-and-public-transit-agencies-may-work-together-36dcb6bf6f47?source=topic_page---------61------------------1,-
Medium.com,Society,Information Design in Public Transportation — Part III,Transportation,https://medium.com/goodpatch-europe/information-design-in-public-transportation-part-iii-a9f8761c3a25?source=topic_page---------62------------------1,-
Medium.com,Society,Socializing Uber for Society & Shareholders,Transportation,https://medium.com/swlh/socializing-uber-for-society-shareholders-5cc4a27d28d4?source=topic_page---------63------------------1,-
Medium.com,Society,"Yes, Transportation is a Public Health Issue",Transportation,https://medium.com/@dlgalos/yes-transportation-is-a-public-health-issue-2bd922c80b2a?source=topic_page---------64------------------1,-
Medium.com,Society,Public Transit Misery Is Bad for the Environment,Transportation,https://medium.com/frontier-group/public-transit-misery-is-bad-for-the-environment-103bef04b44c?source=topic_page---------65------------------1,-
Medium.com,Society,"Tractor trailers damage the road 10,000 times more than a car",Transportation,https://medium.com/numbers-that-matter/tractor-trailers-damage-the-road-10-000-times-more-than-a-car-fb65627b505e?source=topic_page---------66------------------1,-
Medium.com,Society,The Future of Transportation Is Turning out to Be a Public Health Hazard,Transportation,https://medium.com/fast-company/the-future-of-transportation-is-turning-out-to-be-a-public-health-hazard-903f9846c4a9?source=topic_page---------67------------------1,-
Medium.com,Society,Tech need not be expensive to save lives,Transportation,https://medium.com/transportation-matters/tech-needs-not-be-expensive-to-save-lives-9d5fbee1d1cf?source=topic_page---------68------------------1,-
Medium.com,Society,"Driverless and Electric, or Car-Free? The Cities Cutting Out Cars, and Why",Transportation,https://medium.com/digitalagenda/driverless-and-electric-or-car-free-the-cities-cutting-out-cars-and-why-c4c16e141b29?source=topic_page---------69------------------1,-
Medium.com,Society,Technology Won’t Save Us from the Climate Emergency,Transportation,https://medium.com/@thinksustainabilityblog/technology-wont-save-us-from-the-climate-emergency-4968190a688f?source=topic_page---------70------------------1,-
Medium.com,Society,E-Bikes are Coming to Replace Your Car,Transportation,https://medium.com/swlh/e-bikes-are-coming-to-replace-your-car-292973250cf9?source=topic_page---------71------------------1,-
Medium.com,Society,Madrid: the barbarity of taking steps back in the fight against pollution,Transportation,https://medium.com/enrique-dans/madrid-the-barbarity-of-taking-steps-back-in-the-fight-against-pollution-6d533955eefa?source=topic_page---------72------------------1,-
Medium.com,Society,We Need to Talk About Vienna’s Obsession With Cable Cars,Transportation,https://medium.com/@mairibunce/we-need-to-talk-about-viennas-obsession-with-cable-cars-a750163c4e99?source=topic_page---------73------------------1,-
Medium.com,Society,San Francisco’s Quest for Vision Zero,Transportation,https://medium.com/@AbleDart/san-franciscos-quest-for-vision-zero-65114e2fdc89?source=topic_page---------74------------------1,-
Medium.com,Society,TESLA Software v10 — Bringing Car Entertainment To A New Level,Transportation,https://medium.com/0xmachina/tesla-software-v10-bringing-car-entertainment-to-a-new-level-4ea3c689407c?source=topic_page---------75------------------1,-
Medium.com,Society,Moving Along — Micromobility and the future of urban transportation,Transportation,https://medium.com/swlh/moving-along-micromobility-and-the-future-of-urban-transportation-81dbc60251c9?source=topic_page---------76------------------1,-
Medium.com,Society,Transport having another day off,Transportation,https://transportfutures.co/transport-having-another-day-off-b0a99a540fde?source=topic_page---------77------------------1,-
Medium.com,Society,Porsche vs Tesla: False Equivalence,Transportation,https://mondaynote.com/porsche-vs-tesla-false-equivalence-29fd3b55c5b4?source=topic_page---------78------------------1,-
Medium.com,Society,Control Issues,Transportation,https://medium.com/swlh/control-issues-f3af1f5bf9e7?source=topic_page---------79------------------1,-
Medium.com,Society,Amazon’s big move on electric vehicles,Transportation,https://medium.com/u-s-pirg/amazons-big-move-on-electric-vehicles-u-s-pirg-229c0b4a9e27?source=topic_page---------80------------------1,-
Medium.com,Society,Sprinkle Density Around the City,Transportation,https://medium.com/swlh/sprinkle-density-around-the-city-2969ee8b2638?source=topic_page---------81------------------1,-
Medium.com,Society,"Say hello to ‘Flygskam’, the latest Swedish trend threatening to go global",Transportation,https://medium.com/@dannymaiorca/say-hello-to-flygskam-the-latest-swedish-trend-threatening-to-go-global-4e4326eab319?source=topic_page---------82------------------1,-
Medium.com,Society,"Electric Scooter Sharing Wars: Big Players Granted New Permits, Who Will Stand Tall?",Transportation,https://medium.com/@tom.hollestelle/electric-scooter-sharing-wars-big-players-granted-new-permits-who-will-stand-tall-4bb4877e6f9f?source=topic_page---------83------------------1,-
Medium.com,Society,What Kind Of Car Should A Motorcyclist Get?,Transportation,https://medium.com/@krisgage/recommend-a-car-for-a-motorcyclist-9dcb9cc20603?source=topic_page---------84------------------1,-
Medium.com,Society,Driving In Reverse Is A Surprisingly Tough Challenge For Both Human Drivers And Self-Driving Cars,Transportation,https://medium.com/@lance.eliot/driving-in-reverse-is-a-surprisingly-tough-challenge-for-both-human-drivers-and-self-driving-cars-ece80a699c43?source=topic_page---------85------------------1,-
Medium.com,Society,9 best HMI’s from Frankfurt Motor Show (IAA) 2019,Transportation,https://medium.com/swlh/9-best-hmis-from-frankfurt-motor-show-iaa-2019-5f727f5434a7?source=topic_page---------86------------------1,-
Medium.com,Society,Share Bikes and Gentrification,Transportation,https://medium.com/@ardarrian/share-bikes-and-gentrification-d94f5cc97580?source=topic_page---------87------------------1,-
Medium.com,Society,Visualizing Transit Service Deficiencies in San Francisco,Transportation,https://medium.com/@jonobate/visualizing-transit-service-deficiencies-in-san-francisco-f9f9f025d51?source=topic_page---------88------------------1,-
Medium.com,Society,Tesla May Have Invented a Million-Mile Electric Car Battery,Transportation,https://marker.medium.com/tesla-may-have-invented-a-million-mile-electric-car-battery-c3c11cc76d84?source=topic_page---------89------------------1,-
Medium.com,Society,Is free public transport in cities the way forward?,Transportation,https://medium.com/enrique-dans/is-free-public-transport-in-cities-the-way-forward-d81662dfbd5c?source=topic_page---------90------------------1,-
Medium.com,Society,Why India’s push for electric vehicles alone won’t solve its air pollution crisis,Transportation,https://medium.com/rethinking-public-policy/why-indias-push-for-electric-vehicles-alone-won-t-solve-its-air-pollution-crisis-770ce9dff094?source=topic_page---------91------------------1,-
Medium.com,Society,Should we let AI drive?,Transportation,https://medium.com/swlh/should-we-let-ai-drive-7fccbf1f1ab9?source=topic_page---------92------------------1,-
Medium.com,Society,Who Benefits From Crappy Air?,Transportation,https://medium.com/@ericjscholl/who-benefits-from-crappy-air-7becb3254adc?source=topic_page---------93------------------1,-
Medium.com,Society,Building the superblocks: why pedestrianising Barcelona might just save the city’s soul,Transportation,https://medium.com/geographical/building-the-superblocks-why-pedestrianising-barcelona-might-just-save-the-citys-soul-3ace2df0ff7d?source=topic_page---------94------------------1,-
Medium.com,Society,Ridehailing businesses broke the rules. Should they get to make them now?,Transportation,https://medium.com/bestmile/should-cities-use-private-maas-platforms-for-public-transport-5e6841ecf766?source=topic_page---------95------------------1,-
Medium.com,Society,Dealing With the DMV Is Hell — This Startup Helps You Outsource It,Transportation,https://thebolditalic.com/dealing-with-the-dmv-is-hell-this-startup-helps-you-outsource-it-646e98e38b48?source=topic_page---------96------------------1,-
Medium.com,Society,Why AB 5 should be the best thing to happen to ride-hailing since the smartphone:,Transportation,https://medium.com/autofleet/why-ab-5-should-be-the-best-thing-to-happen-to-ride-hailing-since-the-smartphone-be6cf0c87442?source=topic_page---------97------------------1,-
Medium.com,Society,What are the best-selling Chinese cars like… on the track?,Transportation,https://medium.com/@seythmiersma/what-are-the-best-selling-chinese-cars-like-on-the-track-a3ccd466abac?source=topic_page---------98------------------1,-
Medium.com,Society,LiDAR: The Eyes of an Autonomous Vehicle,Transportation,https://medium.com/swlh/lidar-the-eyes-of-an-autonomous-vehicle-82c6252d1101?source=topic_page---------99------------------1,-
Medium.com,Society,NYC Citi Bike Visualization — A Hint of Future Transportation,Transportation,https://medium.com/@sunsai777/nyc-citi-bike-visualization-a-hint-of-future-transportation-5347b4c3d583?source=topic_page---------100------------------1,-
Medium.com,Society,The Future of the Flying Car Ended the American Dream,Transportation,https://medium.com/@josephine.m.yanasak_98329/the-future-of-the-flying-car-ended-the-american-dream-7a49edfd5d5b?source=topic_page---------101------------------1,-
Medium.com,Society,Electric Vehicles Can Help Recharge Public Libraries,Transportation,https://medium.com/@joseph.wildey/electric-vehicles-can-help-recharge-public-libraries-22993151d5c8?source=topic_page---------102------------------1,-
Medium.com,Society,What Driving for Uber Revealed to Me About San Francisco,Transportation,https://thebolditalic.com/what-driving-for-uber-revealed-to-me-about-san-francisco-897b2d7c9690?source=topic_page---------103------------------1,-
Medium.com,Society,"With electric school buses, kids can breathe a little easier",Transportation,https://medium.com/u-s-pirg/with-electric-school-buses-kids-can-breathe-a-little-easier-u-s-pirg-a2d85d29e970?source=topic_page---------104------------------1,-
Medium.com,Society,Blockchain vs Climate Change: Transport,Transportation,https://medium.com/@michaelyorke.93/blockchain-vs-climate-change-transport-ba7939d06f8b?source=topic_page---------105------------------1,-
Medium.com,Society,"THIS is the kinder, gentler Uber?",Transportation,https://medium.com/swlh/this-is-the-kinder-gentler-uber-50bcb5f66e1?source=topic_page---------106------------------1,-
Medium.com,Society,Pão de Ló de Margaride: A tradition that endures in Portugal,Transportation,https://medium.com/@mauricioruiz_2804/p%C3%A3o-de-l%C3%B3-de-margaride-a-tradition-that-endures-in-portugal-47ef3df8af62?source=topic_page---------107------------------1,-
Medium.com,Society,Flying Taxis Are Taking off to Whisk People Around Cities,Transportation,https://medium.com/@the_economist/flying-taxis-are-taking-off-to-whisk-people-around-cities-7d84b5666f8e?source=topic_page---------108------------------1,-
Medium.com,Society,What Did California Just Do to the Gig Economy?,Transportation,https://marker.medium.com/what-did-california-just-do-to-the-gig-economy-6a3a8b88ba76?source=topic_page---------109------------------1,-
