Source,Domain,Heading,Category,URL,Text
Medium.com,Society,How to improve the electric car,Transportation,https://medium.com/@matthias.fill/how-to-improve-the-electric-car-250cd92f2793?source=topic_page---------221------------------1,-
Medium.com,Society,Can Suburban Rail Make Classic Rail Great Again?,Transportation,https://medium.com/ticket-gate-19/can-suburban-rail-make-classic-rail-great-again-5cf659266007?source=topic_page---------222------------------1,-
Medium.com,Society,The Fight Against Climate Change Starts in Cities,Transportation,https://medium.com/@SOM/the-fight-against-climate-change-starts-in-cities-ee0db9b03c5e?source=topic_page---------223------------------1,-
Medium.com,Society,Ride-Sharing Companies Have Enjoyed A Free Ride; Why and How Governments Need To Restore…,Transportation,https://medium.com/t-e-c-h/ride-sharing-companies-have-enjoyed-a-free-ride-why-and-how-governments-need-to-restore-d5ee6eacfae3?source=topic_page---------224------------------1,-
Medium.com,Society,How Startups Can Add to Lyft’s Existing AI,Transportation,https://medium.com/datadriveninvestor/how-startups-can-add-to-lyfts-existing-ai-dd3d8b2a245d?source=topic_page---------225------------------1,-
Medium.com,Society,Are Ticket Hall Queues Dying Across Chinese Railways?,Transportation,https://medium.com/ticket-gate-19/are-ticket-hall-queues-dying-across-chinese-railways-72f235cc7ce4?source=topic_page---------226------------------1,-
Medium.com,Society,A D.C. bridge would better connect black communities to nature. But how will it impact the river?,Transportation,https://medium.com/@UrbanResilience/a-d-c-bridge-would-better-connect-black-communities-to-nature-but-how-will-it-impact-the-river-c4560fb9b483?source=topic_page---------227------------------1,-
Medium.com,Society,Carless in America,Transportation,https://medium.com/@martinedic/carless-in-america-75687cb4340e?source=topic_page---------228------------------1,-
Medium.com,Society,What’s Behind the Rise in Bike Fatalities?,Transportation,https://elemental.medium.com/whats-behind-the-rise-in-bike-fatalities-56a678a17a56?source=topic_page---------229------------------1,-
Medium.com,Society,JFK’s TWA Hotel Has Become an Aviation Nerd’s Paradise,Transportation,https://medium.com/new-york-magazine/jfks-twa-hotel-has-become-an-aviation-nerd-s-paradise-e4d2c7c2d5fc?source=topic_page---------230------------------1,-
Medium.com,Society,When will Ride-hailing be profitable?,Transportation,https://medium.com/@prathmeshss/when-will-ride-hailing-be-profitable-e52aaef5b65b?source=topic_page---------231------------------1,-
Medium.com,Society,Finding the vacant parking slot,Transportation,https://towardsdatascience.com/parking-occupancy-detection-de25cc0966ef?source=topic_page---------233------------------1,-
Medium.com,Society,"Americans Shouldn’t Have to Drive, but the Law Insists on It",Transportation,https://medium.com/the-atlantic/americans-shouldnt-have-to-drive-but-the-law-insists-on-it-d9ad35a2d9c5?source=topic_page---------234------------------1,-
Medium.com,Society,Scientists Create Airplane That Can Land Itself on Any Runway,Transportation,https://medium.com/extremetech-access/scientists-create-airplane-that-can-land-itself-on-any-runway-f7a44ba5d7b3?source=topic_page---------235------------------1,-
Medium.com,Society,Will AVs save the world? History says it’s no sure thing,Transportation,https://medium.com/bestmile/will-avs-save-the-world-history-says-its-no-sure-thing-50a9edf235f1?source=topic_page---------236------------------1,-
Medium.com,Society,Busman’s Holiday,Transportation,https://medium.com/@nathanjames95/busmans-holiday-7eb9e4e45e31?source=topic_page---------237------------------1,-
Medium.com,Society,5 Steps to Design a Competition-Winning Racecar (Formula SAE),Transportation,https://medium.com/swlh/5-steps-to-design-a-competition-winning-racecar-formula-sae-aa8db4e95821?source=topic_page---------238------------------1,-
Medium.com,Society,How We Finished 3rd and Still Won a Data Science Competition,Transportation,https://towardsdatascience.com/how-we-finished-3rd-and-still-won-a-data-science-competition-bf8a71cf8c38?source=topic_page---------239------------------1,-
Medium.com,Society,Driven to Distraction by Language While Driving,Transportation,https://medium.com/@llanirfreelance/driven-to-distraction-by-language-while-driving-bffc41af51e8?source=topic_page---------240------------------1,-
Medium.com,Society,The Lives Behind the Wheel of a Yellow Cab Industry in Decline,Transportation,https://medium.com/@mllzlm/the-lives-behind-the-wheel-of-a-yellow-cab-industry-in-decline-5659cbb6e9a7?source=topic_page---------241------------------1,-
Medium.com,Society,How to Make Public Transport More Convenient Than Driving,Transportation,https://medium.com/bestmile/how-to-make-public-transport-more-convenient-than-driving-59def8e577b7?source=topic_page---------242------------------1,-
Medium.com,Society,3 Key Challenges of Managed Charging for Electric Vehicles and How to Solve Them,Transportation,https://medium.com/@joachim_21503/3-key-challenges-of-managed-charging-for-electric-vehicles-and-how-to-solve-them-f290ad10cc08?source=topic_page---------243------------------1,-
Medium.com,Society,5 Fast & Cheap Ways to Fix Los Angeles Traffic,Transportation,https://medium.com/change-for-la/5-fast-cheap-ways-to-fix-los-angeles-traffic-d457411c0890?source=topic_page---------244------------------1,-
Medium.com,Society,Discovering How Riding on the White Line is the Most Efficient Way to Bike.,Transportation,https://medium.com/riding-the-line/discovering-how-riding-on-the-white-line-is-the-most-efficient-way-to-bike-994ce6cde1e6?source=topic_page---------245------------------1,-
Medium.com,Society,The sound of cars,Transportation,https://medium.com/swlh/the-sound-of-cars-400761fc71f2?source=topic_page---------246------------------1,-
Medium.com,Society,The Mystery Behind the Missing Malaysia Airlines Flight Isn’t Solved Yet,Transportation,https://onezero.medium.com/the-mystery-behind-the-missing-malaysia-airlines-flight-isnt-solved-yet-476f65d9b597?source=topic_page---------247------------------1,-
Medium.com,Society,Are nonexistent connected cars slowing our WiFi?,Transportation,https://medium.com/cgo-benchmark/are-nonexistent-connected-cars-slowing-our-wifi-4bb4650fa503?source=topic_page---------248------------------1,-
Medium.com,Society,Ahead of the curb – How mobility in cities is evolving,Transportation,https://medium.com/design-voices/ahead-of-the-curb-how-mobility-in-cities-is-evolving-6c79b92080a7?source=topic_page---------249------------------1,-
Medium.com,Society,Fine Tuning Steering System Design using MSC Adams,Transportation,https://medium.com/pixmoving/fine-tuning-steering-system-design-using-msc-adams-bb64692f4895?source=topic_page---------250------------------1,-
Medium.com,Society,What’s The Deal With Diesel Sports Cars?,Transportation,https://medium.com/@OferLevinGTI/whats-the-deal-with-diesel-sports-cars-8b1e38cfada2?source=topic_page---------251------------------1,-
Medium.com,Society,America needs to kick its highway habit,Transportation,https://medium.com/u-s-pirg/america-needs-to-kick-its-highway-habit-u-s-pirg-afdfc0cb5223?source=topic_page---------252------------------1,-
Medium.com,Society,Red flags and stupid laws,Transportation,https://medium.com/enrique-dans/red-flags-and-stupid-laws-91e4f492b3c5?source=topic_page---------253------------------1,-
Medium.com,Society,Flying Whales poised to lift off in Montreal thanks to Quebec investment,Transportation,https://medium.com/@neilhaboushjudgement/flying-whales-poised-to-lift-off-in-montreal-thanks-to-quebec-investment-77aaa3e7b4e?source=topic_page---------254------------------1,-
Medium.com,Society,Can Rideshare Change the Real Estate Market and the Economy?,Transportation,https://medium.com/predict/can-rideshare-change-the-real-estate-market-and-the-economy-3f9f852db35?source=topic_page---------255------------------1,-
Medium.com,Society,A Quarter-of-a-Million Healthy Rides,Transportation,https://medium.com/@cottermedian/a-quarter-of-a-million-healthy-rides-c30c571cc8ff?source=topic_page---------256------------------1,-
Medium.com,Society,Will Lyft Ever Make Money?,Transportation,https://medium.com/the-win-column/will-lyft-ever-make-money-11c5ee2041e8?source=topic_page---------257------------------1,-
Medium.com,Society,Zigzag safety,Transportation,https://medium.com/solutions-stories/zigzag-safety-3e94509c1229?source=topic_page---------258------------------1,-
Medium.com,Society,Green Public Transport Innovation in China — an opportunity for BRI countries,Transportation,https://medium.com/@nedopil/green-public-transport-innovation-in-china-an-opportunity-for-bri-countries-44496fb87b67?source=topic_page---------259------------------1,-
Medium.com,Society,Satellite geolocation tech trialed for rail use,Transportation,https://medium.com/utopiapress/satellite-geolocation-tech-trialed-for-rail-use-c878c9daabe7?source=topic_page---------260------------------1,-
Medium.com,Society,Self-Driving Cars Won’t Save Us,Transportation,https://gen.medium.com/driverless-cars-are-a-terrible-solution-to-our-transportation-problems-975ccb3703a6?source=topic_page---------261------------------1,-
Medium.com,Society,Ford’s One-Time Nuclear Concept Car,Transportation,https://medium.com/knowledge-stew/fords-one-time-nuclear-concept-car-a6cc3072f298?source=topic_page---------262------------------1,-
Medium.com,Society,A Micro-Glossary on Micromobility,Transportation,https://medium.com/@annieyjchang/a-micro-glossary-on-micromobility-e9f02b88fb49?source=topic_page---------263------------------1,-
Medium.com,Society,"Driverless Cars May Be Coming, But Let’s Not Get Carried Away",Transportation,https://medium.com/the-new-york-times/driverless-cars-may-be-coming-but-lets-not-get-carried-away-4a38dceb5d6e?source=topic_page---------264------------------1,-
Medium.com,Society,Carmageddon: It’s Killing Urban Life. We Must Reclaim Our Cities Before It’s Too Late,Transportation,https://medium.com/the-guardian/carmageddon-its-killing-urban-life-we-must-reclaim-our-cities-before-it-s-too-late-858821fd1a55?source=topic_page---------265------------------1,-
Medium.com,Society,The State Of Rhode Island Is Piloting A Driverless Shuttle Fleet By Giving Free Rides To Commuters,Transportation,https://medium.com/swlh/the-state-of-rhode-island-is-piloting-a-driverless-shuttle-fleet-by-giving-free-rides-to-commuters-9895d86356b6?source=topic_page---------266------------------1,-
Medium.com,Society,Making ‘green’ in green tech,Transportation,https://medium.com/techpoint-charlie/making-green-in-green-tech-a78167a9664b?source=topic_page---------267------------------1,-
Medium.com,Society,Do more highway lanes spark joy?,Transportation,https://medium.com/the-public-interest-network/do-more-highway-lanes-spark-joy-ed0626b7c177?source=topic_page---------268------------------1,-
Medium.com,Society,"Waiting in the Wings: the world’s first 1,000 km metro system…",Transportation,https://medium.com/ticket-gate-19/waiting-in-the-wings-the-worlds-first-1-000-km-metro-system-1721ac2a3f9e?source=topic_page---------269------------------1,-
Medium.com,Society,Fun with Data — Declaring Climate Emergencies,Transportation,https://transportfutures.co/fun-with-data-declaring-climate-emergencies-bb684ee39719?source=topic_page---------270------------------1,-
Medium.com,Society,Hybrid Airships Could Change the Economics of Asia and Africa,Transportation,https://medium.com/@glenhendrix50/hybrid-airships-could-change-the-economics-of-asia-and-africa-748603da92d7?source=topic_page---------271------------------1,-
Medium.com,Society,Regulation Or Surveillance? LA’s Feud With Uber And Lyft Brings Concerns About Privacy,Transportation,https://medium.com/@lalalosangeles/regulation-or-surveillance-las-feud-with-uber-and-lyft-brings-concerns-about-privacy-a90a39f8a1f8?source=topic_page---------272------------------1,-
Medium.com,Society,Vanished: How Malaysia Airlines Flight 370 Disappeared,Transportation,https://medium.com/the-atlantic/vanished-how-malaysia-airlines-flight-370-disappeared-ecc0afa78335?source=topic_page---------273------------------1,-
Medium.com,Society,Asking your Uber driver #WhatsMyName is the exact opposite of what you should do,Transportation,https://medium.com/@TyWMick/whatsmyname-puts-drivers-at-risk-56285d6a56ac?source=topic_page---------274------------------1,-
Medium.com,Society,My Year Without a Car,Transportation,https://medium.com/@suehubley/my-year-without-a-car-cb17a3639044?source=topic_page---------275------------------1,-
Medium.com,Society,My Colossal Failure with Lyft’s Express Drive Program,Transportation,https://medium.com/swlh/my-colossal-failure-with-lyfts-express-drive-program-68fb02c3288c?source=topic_page---------276------------------1,-
Medium.com,Society,The Electric Vehicle Revolution Will Be Dirty and Unequal,Transportation,https://medium.com/radical-urbanist/the-electric-vehicle-revolution-will-be-dirty-and-unequal-674d9184ee6f?source=topic_page---------277------------------1,-
Medium.com,Society,How to Own a Tesla Model 3 for Free,Transportation,https://entrepreneurshandbook.co/how-to-own-a-tesla-model-3-for-free-fbb28c2fd54?source=topic_page---------278------------------1,-
Medium.com,Society,Sydney’s traffic problem is an issue that can no longer be swept under the rug,Transportation,https://medium.com/@sarahjamess14/sydneys-traffic-problem-is-an-issue-that-can-no-longer-be-swept-under-the-rug-93a72344f1e5?source=topic_page---------279------------------1,-
Medium.com,Society,The Shipping Industry’s Footprint: Why IMO 2020 matters,Transportation,https://medium.com/discourse/the-shipping-industrys-footprint-why-imo-2020-matters-987f3e1afeca?source=topic_page---------280------------------1,-
Medium.com,Society,Uber Sells Aerial Transportation Vision Amid Wary Public Sentiment,Transportation,https://medium.com/cheddar/uber-sells-aerial-transportation-vision-amid-wary-public-sentiment-a2039ebf1a06?source=topic_page---------281------------------1,-
Medium.com,Society,Pursuing a Career in Flight Control Engineering,Transportation,https://medium.com/@fsandre/pursuing-a-career-in-flight-control-engineering-cf271ac2153c?source=topic_page---------282------------------1,-
Medium.com,Society,In-car technology: are we being sold a false sense of security?,Transportation,https://blogs.keele.ac.uk/in-car-technology-are-we-being-sold-a-false-sense-of-security-333422db6624?source=topic_page---------283------------------1,-
Medium.com,Society,Inside the shadow world of scooter chargers,Transportation,https://medium.com/experience-magazine/inside-the-shadow-world-of-scooter-chargers-5c8056a00221?source=topic_page---------284------------------1,-
Medium.com,Society,Mexico City: Connecting the Outskirts to City Centre with Cable Cars,Transportation,https://medium.com/@lauravonputtkamer/mexico-city-connecting-the-outskirts-to-city-centre-with-cable-cars-deeccb6678aa?source=topic_page---------285------------------1,-
Medium.com,Society,This Is Why Uber Drivers Play Such Bad Music,Transportation,https://onezero.medium.com/this-is-why-uber-drivers-play-such-bad-music-ae4ff1c28d9c?source=topic_page---------286------------------1,-
Medium.com,Society,The On the Ground Reality of Drones,Transportation,https://medium.com/swlh/the-on-the-ground-reality-of-drones-ec2ecad43c9e?source=topic_page---------287------------------1,-
Medium.com,Society,VW Rises Again On EV Efforts,Transportation,https://medium.com/discourse/vw-rises-again-on-ev-efforts-7f8986e33f32?source=topic_page---------288------------------1,-
Medium.com,Society,Electric Vehicles Are Driving Demand for Lithium — With Environmental Consequences,Transportation,https://medium.com/forbes/electric-vehicles-are-driving-demand-for-lithium-with-environmental-consequences-6ecbb064e3ed?source=topic_page---------289------------------1,-
Medium.com,Society,Learning From Uber and Lyft: The Case for Passenger Experience in Transit,Transportation,https://medium.com/@YannLeriche/learning-from-uber-and-lyft-the-case-for-passenger-experience-in-transit-b9641a35f4c2?source=topic_page---------290------------------1,-
Medium.com,Society,Forced Communities: Reflecting on Why I Left Southern California to Live in Mexico City,Transportation,https://medium.com/@gregoryflorencio/forced-communities-reflecting-on-why-i-left-southern-california-to-live-in-mexico-city-f99fdb2a14f4?source=topic_page---------291------------------1,-
Medium.com,Society,"The Middle Seat Will Always Suck, but It Might Suck Less in the Future",Transportation,https://medium.com/@josh_66413/the-middle-seat-will-always-suck-but-it-might-suck-less-in-the-future-e72cf95c58fa?source=topic_page---------292------------------1,-
Medium.com,Society,Don’t Smile for Surveillance: Why Airport Face Scans Are a Privacy Trap,Transportation,https://medium.com/thewashingtonpost/dont-smile-for-surveillance-why-airport-face-scans-are-a-privacy-trap-a9b014ca630d?source=topic_page---------293------------------1,-
Medium.com,Society,Internal Combustion Engine and the Four Stroke Engine,Transportation,https://medium.com/swlh/internal-combustion-engine-and-the-four-stroke-engine-12381fc54a98?source=topic_page---------294------------------1,-
Medium.com,Society,BYD is on a mission to bring electric buses to the world,Transportation,https://medium.com/enrique-dans/byd-is-on-a-mission-to-bring-electric-buses-to-the-world-58a5d8feb2dc?source=topic_page---------295------------------1,-
Medium.com,Society,Front and Rear Seat Belt Reminders,Transportation,https://medium.com/@daviddeveau/front-and-rear-seat-belt-reminders-d4c2cbb9bed0?source=topic_page---------296------------------1,-
Medium.com,Society,Is Future Mobility the New White Flight?,Transportation,https://medium.com/@joseph.wildey/is-future-mobility-the-new-white-flight-96a73cd3be2c?source=topic_page---------297------------------1,-
Medium.com,Society,What do Tragedies Like the Boeing MAX 8 Crashes Do to Perception of Autonomy?,Transportation,https://medium.com/@baumhedlund/what-do-tragedies-like-the-boeing-max-8-crashes-do-to-perception-of-autonomy-c9afef21c0cc?source=topic_page---------298------------------1,-
Medium.com,Society,Waiting for The Robocars,Transportation,https://medium.com/swlh/waiting-for-the-robocars-64e13e206e0b?source=topic_page---------299------------------1,-
Medium.com,Society,Uber’s $200 Helicopter Ride is a Preview of its Pricey Flying Cars,Transportation,https://medium.com/radical-urbanist/ubers-200-helicopter-ride-is-a-preview-of-its-pricey-flying-cars-b95d570403c9?source=topic_page---------300------------------1,-
Medium.com,Society,Tesla Level 5: Autopilot,Transportation,https://towardsdatascience.com/tesla-level-5-autopilot-669f6ac6ee63?source=topic_page---------301------------------1,-
Medium.com,Society,Switching to scooter-life changed my life for the better (and why you should consider switching…,Transportation,https://medium.com/@leahdiprose/switching-to-scooter-life-changed-my-life-for-the-better-2305adb66a54?source=topic_page---------302------------------1,-
Medium.com,Society,Madcap Delinquent Prophet on a Scooter,Transportation,https://medium.com/publishous/madcap-delinquent-prophet-on-a-scooter-a5b3098f6729?source=topic_page---------303------------------1,-
Medium.com,Society,What Highway Removal Could Do For Our Cities,Transportation,https://medium.com/move-forward-blog/what-highway-removal-could-do-for-our-cities-d82021d71de?source=topic_page---------304------------------1,-
Medium.com,Society,A.I. Is Not as Advanced as You Might Think,Transportation,https://zora.medium.com/a-i-is-not-as-advanced-as-you-might-think-97657e9eecdc?source=topic_page---------305------------------1,-
Medium.com,Society,CARS: Aloha 2019 Hyundai Kona,Transportation,https://medium.com/lug-magazine/cars-aloha-2019-hyundai-kona-8f9660ec2498?source=topic_page---------306------------------1,-
Medium.com,Society,Car Rental Companies: Evolving with Consumer Needs,Transportation,https://medium.com/@INVERSmobility/car-rental-companies-evolving-with-consumer-needs-99e15ddb9a70?source=topic_page---------307------------------1,-
Medium.com,Society,Deep Learning For Autonomous Cars And The Role Of Imitation,Transportation,https://medium.com/@lance.eliot/deep-learning-for-autonomous-cars-and-the-role-of-imitation-d5fae462210d?source=topic_page---------308------------------1,-
Medium.com,Society,Elon Musk’s Boring Company To Build Tunnel System In Las Vegas,Transportation,https://medium.com/swlh/elon-musks-boring-company-to-build-tunnel-system-in-las-vegas-65e5080beedb?source=topic_page---------309------------------1,-
Medium.com,Society,"London and Oslo Took On Cars, But the Key was Investing in Alternatives",Transportation,https://medium.com/radical-urbanist/london-and-oslo-took-on-cars-but-the-key-was-investing-in-alternatives-b1497027879a?source=topic_page---------310------------------1,-
Medium.com,Society,Can Amazon Really Go End-to-End In Ocean Freight?,Transportation,https://medium.com/swlh/can-amazon-really-go-end-to-end-in-ocean-freight-279026a6ee47?source=topic_page---------311------------------1,-
Medium.com,Society,Why Transportation Must be a Part of Resilience Planning in Puerto Rico,Transportation,https://medium.com/planblog/why-transportation-must-be-a-part-of-resilience-planning-in-puerto-rico-b2382e4db1b?source=topic_page---------312------------------1,-
Medium.com,Society,3 Things You Need to Know About Bike-Transit Integration,Transportation,https://blog.altaplanning.com/3-things-you-need-to-know-about-bike-transit-integration-130d477568c6?source=topic_page---------313------------------1,-
Medium.com,Society,Elon Musk’s One Million Robo-Cabs,Transportation,https://medium.com/technofile/elon-musks-one-million-robo-cabs-74d7c257469b?source=topic_page---------314------------------1,-
Medium.com,Society,NYC Subway’s Tap-to-Pay Launch Has Financial Giants Revved Up for the End of Cash,Transportation,https://medium.com/cheddar/nyc-subways-tap-to-pay-launch-has-financial-giants-revved-up-for-the-end-of-cash-25e9379fdd09?source=topic_page---------315------------------1,-
Medium.com,Society,"Man, Machine, Plane",Transportation,https://medium.com/swlh/man-machine-plane-860c105a3d3c?source=topic_page---------316------------------1,-
Medium.com,Society,The Hyperloop Concept Is Finally Growing Up,Transportation,https://onezero.medium.com/the-hyperloop-concept-is-finally-growing-up-6b3ed448731e?source=topic_page---------317------------------1,-
Medium.com,Society,The Science of How Car Sounds Seduce Our Brains,Transportation,https://medium.com/swlh/https-medium-com-jeremyhsu-how-shapeshifting-car-sounds-seduce-our-brains-733f0d59847b?source=topic_page---------318------------------1,-
Medium.com,Society,Who’s Really Inventing the Future of Public Transportation?,Transportation,https://medium.com/move-forward-blog/whos-really-inventing-the-future-of-public-transportation-c33a159e765?source=topic_page---------319------------------1,-
Medium.com,Society,Will mobility subscription models work?,Transportation,https://medium.com/move-forward-blog/will-mobility-subscription-models-work-124adf219c97?source=topic_page---------320------------------1,-
Medium.com,Society,How Peer-to-Peer Carsharing Is Reshaping Our Relationship with Auto Mobility: Early Understanding…,Transportation,https://medium.com/move-forward-blog/how-peer-to-peer-carsharing-is-reshaping-our-relationship-with-auto-mobility-early-understanding-d99debd4b7cd?source=topic_page---------321------------------1,-
Medium.com,Society,Understanding Impacts of Incentives on One-Way Electric Vehicle Carsharing: A Case Study of Car2go…,Transportation,https://medium.com/move-forward-blog/understanding-impacts-of-incentives-on-one-way-electric-vehicle-carsharing-a-case-study-of-car2go-640adbe8bee6?source=topic_page---------322------------------1,-
Medium.com,Society,The eGallon has arrived,Transportation,https://medium.com/discourse/the-egallon-has-arrived-674bce4d933a?source=topic_page---------323------------------1,-
Medium.com,Society,Why New York Can’t Have Nice Things,Transportation,https://medium.com/new-york-magazine/why-new-york-cant-have-nice-things-79febaf90f7f?source=topic_page---------324------------------1,-
Medium.com,Society,Sydney Metro’s first day in service,Transportation,https://medium.com/@gabkomarnicki/sydney-metros-first-day-in-service-9d6326c270d5?source=topic_page---------325------------------1,-
Medium.com,Society,Why did I buy an $8100 Nissan Leaf?,Transportation,https://medium.com/man-made-electric/why-did-i-buy-an-8100-nissan-leaf-f825fe918ce8?source=topic_page---------326------------------1,-
Medium.com,Society,"Why Tesla, Not Waymo, is the Leader in Self-Driving Car Development",Transportation,https://medium.com/@trenteady/why-tesla-not-waymo-is-the-leader-in-self-driving-car-development-8eff18c65d3c?source=topic_page---------327------------------1,-
Medium.com,Society,Kerb Management — A word of warning,Transportation,https://transportfutures.co/kerb-management-a-word-of-warning-9ed101b69f74?source=topic_page---------328------------------1,-
Medium.com,Society,The So-Called Thrill of Fare Evasion,Transportation,https://medium.com/move-forward-blog/the-so-called-thrill-of-fare-evasion-4d6ea39783a8?source=topic_page---------329------------------1,-
Medium.com,Society,Public Transit Use for Disaster Recovery,Transportation,https://medium.com/move-forward-blog/public-transit-use-for-disaster-recovery-339a8209a2ae?source=topic_page---------330------------------1,-
Medium.com,Society,Is the Union Pacific in Trouble? — Market Mad House,Transportation,https://medium.com/datadriveninvestor/is-the-union-pacific-in-trouble-market-mad-house-446a094ac343?source=topic_page---------331------------------1,-
